00:28:28.374595 IP (tos 0x0, ttl 113, id 15263, offset 0, flags [DF], proto TCP (6), length 48)
    98.114.205.102.1821 > 192.150.11.111.445: Flags [S], cksum 0xfa44 (correct), seq 147554406, win 64240, options [mss 1460,nop,nop,sackOK], length 0
00:28:28.375059 IP (tos 0x0, ttl 64, id 0, offset 0, flags [DF], proto TCP (6), length 48)
    192.150.11.111.445 > 98.114.205.102.1821: Flags [S.], cksum 0xd9a4 (correct), seq 1547413620, ack 147554407, win 5840, options [mss 1460,nop,nop,sackOK], length 0
00:28:28.493653 IP (tos 0x0, ttl 113, id 15277, offset 0, flags [DF], proto TCP (6), length 40)
    98.114.205.102.1821 > 192.150.11.111.445: Flags [.], cksum 0x2248 (correct), seq 1, ack 1, win 64240, length 0
00:28:28.508770 IP (tos 0x0, ttl 113, id 15278, offset 0, flags [DF], proto TCP (6), length 40)
    98.114.205.102.1821 > 192.150.11.111.445: Flags [F.], cksum 0x2247 (correct), seq 1, ack 1, win 64240, length 0
00:28:28.509145 IP (tos 0x0, ttl 113, id 15279, offset 0, flags [DF], proto TCP (6), length 48)
    98.114.205.102.1828 > 192.150.11.111.445: Flags [S], cksum 0x837d (correct), seq 147846946, win 64240, options [mss 1460,nop,nop,sackOK], length 0
00:28:28.509473 IP (tos 0x0, ttl 64, id 0, offset 0, flags [DF], proto TCP (6), length 48)
    192.150.11.111.445 > 98.114.205.102.1828: Flags [S.], cksum 0xfcf9 (correct), seq 1540689598, ack 147846947, win 5840, options [mss 1460,nop,nop,sackOK], length 0
00:28:28.509788 IP (tos 0x0, ttl 64, id 41844, offset 0, flags [DF], proto TCP (6), length 40)
    192.150.11.111.445 > 98.114.205.102.1821: Flags [.], cksum 0x0668 (correct), seq 1, ack 2, win 5840, length 0
00:28:28.612764 IP (tos 0x0, ttl 64, id 41845, offset 0, flags [DF], proto TCP (6), length 40)
    192.150.11.111.445 > 98.114.205.102.1821: Flags [F.], cksum 0x0667 (correct), seq 1, ack 2, win 5840, length 0
00:28:28.626454 IP (tos 0x0, ttl 113, id 15284, offset 0, flags [DF], proto TCP (6), length 40)
    98.114.205.102.1828 > 192.150.11.111.445: Flags [.], cksum 0x459d (correct), seq 1, ack 1, win 64240, length 0
00:28:28.642319 IP (tos 0x0, ttl 113, id 15286, offset 0, flags [DF], proto TCP (6), length 177)
    98.114.205.102.1828 > 192.150.11.111.445: Flags [P.], cksum 0x7cd5 (correct), seq 1:138, ack 1, win 64240, length 137
00:28:28.642330 IP (tos 0x0, ttl 64, id 1437, offset 0, flags [DF], proto TCP (6), length 40)
    192.150.11.111.445 > 98.114.205.102.1828: Flags [.], cksum 0x26e5 (correct), seq 1, ack 138, win 6432, length 0
00:28:28.728897 IP (tos 0x0, ttl 113, id 15299, offset 0, flags [DF], proto TCP (6), length 40)
    98.114.205.102.1821 > 192.150.11.111.445: Flags [.], cksum 0x2246 (correct), seq 2, ack 2, win 64240, length 0
00:28:28.861731 IP (tos 0x0, ttl 64, id 1438, offset 0, flags [DF], proto TCP (6), length 129)
    192.150.11.111.445 > 98.114.205.102.1828: Flags [P.], cksum 0xa9ae (correct), seq 1:90, ack 138, win 6432, length 89
00:28:28.976883 IP (tos 0x0, ttl 113, id 15320, offset 0, flags [DF], proto TCP (6), length 208)
    98.114.205.102.1828 > 192.150.11.111.445: Flags [P.], cksum 0x3653 (correct), seq 138:306, ack 90, win 64151, length 168
00:28:28.976898 IP (tos 0x0, ttl 64, id 1439, offset 0, flags [DF], proto TCP (6), length 40)
    192.150.11.111.445 > 98.114.205.102.1828: Flags [.], cksum 0x21b4 (correct), seq 90, ack 306, win 7504, length 0
00:28:29.097596 IP (tos 0x0, ttl 64, id 1440, offset 0, flags [DF], proto TCP (6), length 297)
    192.150.11.111.445 > 98.114.205.102.1828: Flags [P.], cksum 0x3ce7 (correct), seq 90:347, ack 306, win 7504, length 257
00:28:29.215000 IP (tos 0x0, ttl 113, id 15344, offset 0, flags [DF], proto TCP (6), length 262)
    98.114.205.102.1828 > 192.150.11.111.445: Flags [P.], cksum 0xbe29 (correct), seq 306:528, ack 347, win 63894, length 222
00:28:29.215014 IP (tos 0x0, ttl 64, id 1441, offset 0, flags [DF], proto TCP (6), length 40)
    192.150.11.111.445 > 98.114.205.102.1828: Flags [.], cksum 0x1ba5 (correct), seq 347, ack 528, win 8576, length 0
00:28:29.332212 IP (tos 0x0, ttl 64, id 1442, offset 0, flags [DF], proto TCP (6), length 161)
    192.150.11.111.445 > 98.114.205.102.1828: Flags [P.], cksum 0xea99 (correct), seq 347:468, ack 528, win 8576, length 121
00:28:29.447746 IP (tos 0x0, ttl 113, id 15371, offset 0, flags [DF], proto TCP (6), length 138)
    98.114.205.102.1828 > 192.150.11.111.445: Flags [P.], cksum 0x612d (correct), seq 528:626, ack 468, win 63773, length 98
00:28:29.447769 IP (tos 0x0, ttl 64, id 1443, offset 0, flags [DF], proto TCP (6), length 40)
    192.150.11.111.445 > 98.114.205.102.1828: Flags [.], cksum 0x1aca (correct), seq 468, ack 626, win 8576, length 0
00:28:29.563969 IP (tos 0x0, ttl 64, id 1444, offset 0, flags [DF], proto TCP (6), length 100)
    192.150.11.111.445 > 98.114.205.102.1828: Flags [P.], cksum 0xc37e (correct), seq 468:528, ack 626, win 8576, length 60
00:28:29.681740 IP (tos 0x0, ttl 113, id 15382, offset 0, flags [DF], proto TCP (6), length 144)
    98.114.205.102.1828 > 192.150.11.111.445: Flags [P.], cksum 0x48d8 (correct), seq 626:730, ack 528, win 63713, length 104
00:28:29.681763 IP (tos 0x0, ttl 64, id 1445, offset 0, flags [DF], proto TCP (6), length 40)
    192.150.11.111.445 > 98.114.205.102.1828: Flags [.], cksum 0x1a26 (correct), seq 528, ack 730, win 8576, length 0
00:28:29.799455 IP (tos 0x0, ttl 64, id 1446, offset 0, flags [DF], proto TCP (6), length 179)
    192.150.11.111.445 > 98.114.205.102.1828: Flags [P.], cksum 0xf6b4 (correct), seq 528:667, ack 730, win 8576, length 139
00:28:29.916984 IP (tos 0x0, ttl 113, id 15407, offset 0, flags [DF], proto TCP (6), length 200)
    98.114.205.102.1828 > 192.150.11.111.445: Flags [P.], cksum 0xab39 (correct), seq 730:890, ack 667, win 63574, length 160
00:28:29.916996 IP (tos 0x0, ttl 64, id 1447, offset 0, flags [DF], proto TCP (6), length 40)
    192.150.11.111.445 > 98.114.205.102.1828: Flags [.], cksum 0x14cb (correct), seq 667, ack 890, win 9648, length 0
00:28:30.044814 IP (tos 0x0, ttl 64, id 1448, offset 0, flags [DF], proto TCP (6), length 168)
    192.150.11.111.445 > 98.114.205.102.1828: Flags [P.], cksum 0xfdc3 (correct), seq 667:795, ack 890, win 9648, length 128
00:28:30.172468 IP (tos 0x0, ttl 113, id 15421, offset 0, flags [DF], proto TCP (6), length 1500)
    98.114.205.102.1828 > 192.150.11.111.445: Flags [.], cksum 0xcc1c (correct), seq 890:2350, ack 795, win 63446, length 1460
00:28:30.172481 IP (tos 0x0, ttl 64, id 1449, offset 0, flags [DF], proto TCP (6), length 40)
    192.150.11.111.445 > 98.114.205.102.1828: Flags [.], cksum 0x06a7 (correct), seq 795, ack 2350, win 11680, length 0
00:28:30.178588 IP (tos 0x0, ttl 113, id 15422, offset 0, flags [DF], proto TCP (6), length 1500)
    98.114.205.102.1828 > 192.150.11.111.445: Flags [.], cksum 0x84e7 (correct), seq 2350:3810, ack 795, win 63446, length 1460
00:28:30.178598 IP (tos 0x0, ttl 64, id 1450, offset 0, flags [DF], proto TCP (6), length 40)
    192.150.11.111.445 > 98.114.205.102.1828: Flags [.], cksum 0xf58a (correct), seq 795, ack 3810, win 14600, length 0
00:28:30.180587 IP (tos 0x0, ttl 113, id 15423, offset 0, flags [DF], proto TCP (6), length 440)
    98.114.205.102.1828 > 192.150.11.111.445: Flags [P.], cksum 0xc6e6 (correct), seq 3810:4210, ack 795, win 63446, length 400
00:28:30.180596 IP (tos 0x0, ttl 64, id 1451, offset 0, flags [DF], proto TCP (6), length 40)
    192.150.11.111.445 > 98.114.205.102.1828: Flags [.], cksum 0xe892 (correct), seq 795, ack 4210, win 17520, length 0
00:28:30.353241 IP (tos 0x0, ttl 113, id 15436, offset 0, flags [DF], proto TCP (6), length 40)
    98.114.205.102.1828 > 192.150.11.111.445: Flags [.], cksum 0x352c (correct), seq 4210, ack 795, win 63446, length 0
00:28:30.466428 IP (tos 0x0, ttl 113, id 15455, offset 0, flags [DF], proto TCP (6), length 48)
    98.114.205.102.1924 > 192.150.11.111.1957: Flags [S], cksum 0xe667 (correct), seq 152210861, win 64240, options [mss 1460,nop,nop,sackOK], length 0
00:28:30.466840 IP (tos 0x0, ttl 64, id 0, offset 0, flags [DF], proto TCP (6), length 48)
    192.150.11.111.1957 > 98.114.205.102.1924: Flags [S.], cksum 0x0b73 (correct), seq 1554014820, ack 152210862, win 5840, options [mss 1460,nop,nop,sackOK], length 0
00:28:30.509185 IP (tos 0x0, ttl 64, id 1452, offset 0, flags [DF], proto TCP (6), length 148)
    192.150.11.111.445 > 98.114.205.102.1828: Flags [P.], cksum 0x7ea1 (correct), seq 795:903, ack 4210, win 17520, length 108
00:28:30.583738 IP (tos 0x0, ttl 113, id 15463, offset 0, flags [DF], proto TCP (6), length 40)
    98.114.205.102.1924 > 192.150.11.111.1957: Flags [.], cksum 0x5416 (correct), seq 1, ack 1, win 64240, length 0
00:28:30.753894 IP (tos 0x0, ttl 113, id 15482, offset 0, flags [DF], proto TCP (6), length 40)
    98.114.205.102.1828 > 192.150.11.111.445: Flags [.], cksum 0x352c (correct), seq 4210, ack 903, win 63338, length 0
00:28:31.701948 IP (tos 0x0, ttl 64, id 28526, offset 0, flags [DF], proto TCP (6), length 41)
    192.150.11.111.1957 > 98.114.205.102.1924: Flags [P.], cksum 0x2e2e (correct), seq 1:2, ack 1, win 5840, length 1
00:28:31.819551 IP (tos 0x0, ttl 113, id 15568, offset 0, flags [DF], proto TCP (6), length 163)
    98.114.205.102.1924 > 192.150.11.111.1957: Flags [P.], cksum 0xf559 (correct), seq 1:124, ack 2, win 64239, length 123
00:28:31.819566 IP (tos 0x0, ttl 64, id 28527, offset 0, flags [DF], proto TCP (6), length 40)
    192.150.11.111.1957 > 98.114.205.102.1924: Flags [.], cksum 0x37bb (correct), seq 2, ack 124, win 5840, length 0
00:28:32.318772 IP (tos 0x0, ttl 113, id 15610, offset 0, flags [DF], proto TCP (6), length 50)
    98.114.205.102.1924 > 192.150.11.111.1957: Flags [P.], cksum 0xbecd (correct), seq 124:134, ack 2, win 64239, length 10
00:28:32.318780 IP (tos 0x0, ttl 64, id 28528, offset 0, flags [DF], proto TCP (6), length 40)
    192.150.11.111.1957 > 98.114.205.102.1924: Flags [.], cksum 0x37b1 (correct), seq 2, ack 134, win 5840, length 0
00:28:33.317950 IP (tos 0x0, ttl 64, id 28529, offset 0, flags [DF], proto TCP (6), length 41)
    192.150.11.111.1957 > 98.114.205.102.1924: Flags [P.], cksum 0x2da8 (correct), seq 2:3, ack 134, win 5840, length 1
00:28:33.446644 IP (tos 0x0, ttl 113, id 15702, offset 0, flags [DF], proto TCP (6), length 40)
    98.114.205.102.1924 > 192.150.11.111.1957: Flags [F.], cksum 0x5390 (correct), seq 134, ack 3, win 64238, length 0
00:28:33.446686 IP (tos 0x0, ttl 64, id 28530, offset 0, flags [DF], proto TCP (6), length 40)
    192.150.11.111.1957 > 98.114.205.102.1924: Flags [F.], cksum 0x37ae (correct), seq 3, ack 135, win 5840, length 0
00:28:33.447268 IP (tos 0x0, ttl 113, id 15703, offset 0, flags [DF], proto TCP (6), length 40)
    98.114.205.102.1828 > 192.150.11.111.445: Flags [R], cksum 0x9abd (correct), seq 147851156, win 0, length 0
00:28:33.457215 IP (tos 0x0, ttl 64, id 12614, offset 0, flags [DF], proto TCP (6), length 60)
    192.150.11.111.36296 > 98.114.205.102.8884: Flags [S], cksum 0xe880 (correct), seq 1545682588, win 5840, options [mss 1460,sackOK,TS val 4055633882 ecr 0,nop,wscale 7], length 0
00:28:33.566451 IP (tos 0x0, ttl 113, id 15711, offset 0, flags [DF], proto TCP (6), length 40)
    98.114.205.102.1924 > 192.150.11.111.1957: Flags [.], cksum 0x538f (correct), seq 135, ack 4, win 64238, length 0
00:28:33.576321 IP (tos 0x0, ttl 113, id 15720, offset 0, flags [DF], proto TCP (6), length 64)
    98.114.205.102.8884 > 192.150.11.111.36296: Flags [S.], cksum 0xdd49 (correct), seq 159517979, ack 1545682589, win 64240, options [mss 1460,nop,wscale 0,nop,nop,TS val 0 ecr 0,nop,nop,sackOK], length 0
00:28:33.576335 IP (tos 0x0, ttl 64, id 12615, offset 0, flags [DF], proto TCP (6), length 52)
    192.150.11.111.36296 > 98.114.205.102.8884: Flags [.], cksum 0x1724 (correct), seq 1, ack 1, win 46, options [nop,nop,TS val 4055633911 ecr 0], length 0
00:28:33.723988 IP (tos 0x0, ttl 113, id 15726, offset 0, flags [DF], proto TCP (6), length 73)
    98.114.205.102.8884 > 192.150.11.111.36296: Flags [P.], cksum 0x16db (correct), seq 1:22, ack 1, win 64240, options [nop,nop,TS val 438613 ecr 4055633911], length 21
00:28:33.724000 IP (tos 0x0, ttl 64, id 12616, offset 0, flags [DF], proto TCP (6), length 52)
    192.150.11.111.36296 > 98.114.205.102.8884: Flags [.], cksum 0x658e (correct), seq 1, ack 22, win 46, options [nop,nop,TS val 4055633948 ecr 438613], length 0
00:28:33.724062 IP (tos 0x0, ttl 64, id 12617, offset 0, flags [DF], proto TCP (6), length 60)
    192.150.11.111.36296 > 98.114.205.102.8884: Flags [P.], cksum 0x9d9d (correct), seq 1:9, ack 22, win 46, options [nop,nop,TS val 4055633948 ecr 438613], length 8
00:28:33.848919 IP (tos 0x0, ttl 113, id 15738, offset 0, flags [DF], proto TCP (6), length 74)
    98.114.205.102.8884 > 192.150.11.111.36296: Flags [P.], cksum 0x86f3 (correct), seq 22:44, ack 9, win 64232, options [nop,nop,TS val 438614 ecr 4055633948], length 22
00:28:33.848968 IP (tos 0x0, ttl 64, id 12618, offset 0, flags [DF], proto TCP (6), length 60)
    192.150.11.111.36296 > 98.114.205.102.8884: Flags [P.], cksum 0x946f (correct), seq 9:17, ack 44, win 46, options [nop,nop,TS val 4055633980 ecr 438614], length 8
00:28:33.979097 IP (tos 0x0, ttl 113, id 15757, offset 0, flags [DF], proto TCP (6), length 72)
    98.114.205.102.8884 > 192.150.11.111.36296: Flags [P.], cksum 0x5a6b (correct), seq 44:64, ack 17, win 64224, options [nop,nop,TS val 438616 ecr 4055633980], length 20
00:28:33.979161 IP (tos 0x0, ttl 64, id 12619, offset 0, flags [DF], proto TCP (6), length 58)
    192.150.11.111.36296 > 98.114.205.102.8884: Flags [P.], cksum 0xb14b (correct), seq 17:23, ack 64, win 46, options [nop,nop,TS val 4055634012 ecr 438616], length 6
00:28:34.111522 IP (tos 0x0, ttl 113, id 15769, offset 0, flags [DF], proto TCP (6), length 65)
    98.114.205.102.8884 > 192.150.11.111.36296: Flags [P.], cksum 0x862b (correct), seq 64:77, ack 23, win 64218, options [nop,nop,TS val 438617 ecr 4055634012], length 13
00:28:34.111576 IP (tos 0x0, ttl 64, id 12620, offset 0, flags [DF], proto TCP (6), length 60)
    192.150.11.111.36296 > 98.114.205.102.8884: Flags [P.], cksum 0x92da (correct), seq 23:31, ack 77, win 46, options [nop,nop,TS val 4055634045 ecr 438617], length 8
00:28:34.246448 IP (tos 0x0, ttl 113, id 15773, offset 0, flags [DF], proto TCP (6), length 71)
    98.114.205.102.8884 > 192.150.11.111.36296: Flags [P.], cksum 0xda39 (correct), seq 77:96, ack 31, win 64210, options [nop,nop,TS val 438618 ecr 4055634045], length 19
00:28:34.246531 IP (tos 0x0, ttl 64, id 12621, offset 0, flags [DF], proto TCP (6), length 78)
    192.150.11.111.36296 > 98.114.205.102.8884: Flags [P.], cksum 0xccdc (incorrect -> 0xd0ec), seq 31:57, ack 96, win 46, options [nop,nop,TS val 4055634079 ecr 438618], length 26
00:28:34.383995 IP (tos 0x0, ttl 113, id 15788, offset 0, flags [DF], proto TCP (6), length 81)
    98.114.205.102.8884 > 192.150.11.111.36296: Flags [P.], cksum 0xaff4 (correct), seq 96:125, ack 57, win 64184, options [nop,nop,TS val 438620 ecr 4055634079], length 29
00:28:34.384010 IP (tos 0x0, ttl 64, id 12622, offset 0, flags [DF], proto TCP (6), length 67)
    192.150.11.111.36296 > 98.114.205.102.8884: Flags [P.], cksum 0xe1ff (correct), seq 57:72, ack 125, win 46, options [nop,nop,TS val 4055634113 ecr 438620], length 15
00:28:34.516421 IP (tos 0x0, ttl 113, id 15803, offset 0, flags [DF], proto TCP (6), length 92)
    98.114.205.102.8884 > 192.150.11.111.36296: Flags [P.], cksum 0x9906 (correct), seq 125:165, ack 72, win 64169, options [nop,nop,TS val 438621 ecr 4055634113], length 40
00:28:34.516921 IP (tos 0x0, ttl 113, id 15804, offset 0, flags [DF], proto TCP (6), length 48)
    98.114.205.102.2152 > 192.150.11.111.1080: Flags [S], cksum 0xd38c (correct), seq 161784447, win 64240, options [mss 1460,nop,nop,sackOK], length 0
00:28:34.517395 IP (tos 0x0, ttl 64, id 0, offset 0, flags [DF], proto TCP (6), length 48)
    192.150.11.111.1080 > 98.114.205.102.2152: Flags [S.], cksum 0xb6cb (correct), seq 1551410264, ack 161784448, win 5840, options [mss 1460,nop,nop,sackOK], length 0
00:28:34.553957 IP (tos 0x0, ttl 64, id 12623, offset 0, flags [DF], proto TCP (6), length 52)
    192.150.11.111.36296 > 98.114.205.102.8884: Flags [.], cksum 0x63e0 (correct), seq 72, ack 165, win 46, options [nop,nop,TS val 4055634156 ecr 438621], length 0
00:28:34.631358 IP (tos 0x0, ttl 113, id 15811, offset 0, flags [DF], proto TCP (6), length 40)
    98.114.205.102.2152 > 192.150.11.111.1080: Flags [.], cksum 0xff6e (correct), seq 1, ack 1, win 64240, length 0
00:28:34.648099 IP (tos 0x0, ttl 113, id 15812, offset 0, flags [DF], proto TCP (6), length 1064)
    98.114.205.102.2152 > 192.150.11.111.1080: Flags [P.], cksum 0xdcb3 (correct), seq 1:1025, ack 1, win 64240, length 1024
00:28:34.648110 IP (tos 0x0, ttl 64, id 46246, offset 0, flags [DF], proto TCP (6), length 40)
    192.150.11.111.1080 > 98.114.205.102.2152: Flags [.], cksum 0xda5f (correct), seq 1, ack 1025, win 7168, length 0
00:28:34.657218 IP (tos 0x0, ttl 113, id 15820, offset 0, flags [DF], proto TCP (6), length 1500)
    98.114.205.102.2152 > 192.150.11.111.1080: Flags [.], cksum 0x832b (correct), seq 1025:2485, ack 1, win 64240, length 1460
00:28:34.657237 IP (tos 0x0, ttl 64, id 46247, offset 0, flags [DF], proto TCP (6), length 40)
    192.150.11.111.1080 > 98.114.205.102.2152: Flags [.], cksum 0xc8bf (correct), seq 1, ack 2485, win 10220, length 0
00:28:34.659342 IP (tos 0x0, ttl 113, id 15821, offset 0, flags [DF], proto TCP (6), length 476)
    98.114.205.102.2152 > 192.150.11.111.1080: Flags [P.], cksum 0xeba4 (correct), seq 2485:2921, ack 1, win 64240, length 436
00:28:34.659359 IP (tos 0x0, ttl 64, id 46248, offset 0, flags [DF], proto TCP (6), length 40)
    192.150.11.111.1080 > 98.114.205.102.2152: Flags [.], cksum 0xbba3 (correct), seq 1, ack 2921, win 13140, length 0
00:28:34.769905 IP (tos 0x0, ttl 113, id 15825, offset 0, flags [DF], proto TCP (6), length 1500)
    98.114.205.102.2152 > 192.150.11.111.1080: Flags [.], cksum 0xbc9d (correct), seq 2921:4381, ack 1, win 64240, length 1460
00:28:34.769922 IP (tos 0x0, ttl 64, id 46249, offset 0, flags [DF], proto TCP (6), length 40)
    192.150.11.111.1080 > 98.114.205.102.2152: Flags [.], cksum 0xaa87 (correct), seq 1, ack 4381, win 16060, length 0
00:28:34.774403 IP (tos 0x0, ttl 113, id 15826, offset 0, flags [DF], proto TCP (6), length 1064)
    98.114.205.102.2152 > 192.150.11.111.1080: Flags [P.], cksum 0x2e08 (correct), seq 4381:5405, ack 1, win 64240, length 1024
00:28:34.774421 IP (tos 0x0, ttl 64, id 46250, offset 0, flags [DF], proto TCP (6), length 40)
    192.150.11.111.1080 > 98.114.205.102.2152: Flags [.], cksum 0x9b1f (correct), seq 1, ack 5405, win 18980, length 0
00:28:34.780650 IP (tos 0x0, ttl 113, id 15827, offset 0, flags [DF], proto TCP (6), length 1500)
    98.114.205.102.2152 > 192.150.11.111.1080: Flags [.], cksum 0xb8a8 (correct), seq 5405:6865, ack 1, win 64240, length 1460
00:28:34.780666 IP (tos 0x0, ttl 64, id 46251, offset 0, flags [DF], proto TCP (6), length 40)
    192.150.11.111.1080 > 98.114.205.102.2152: Flags [.], cksum 0x8a03 (correct), seq 1, ack 6865, win 21900, length 0
00:28:34.786396 IP (tos 0x0, ttl 113, id 15828, offset 0, flags [DF], proto TCP (6), length 1368)
    98.114.205.102.2152 > 192.150.11.111.1080: Flags [P.], cksum 0xc708 (correct), seq 6865:8193, ack 1, win 64240, length 1328
00:28:34.786414 IP (tos 0x0, ttl 64, id 46252, offset 0, flags [DF], proto TCP (6), length 40)
    192.150.11.111.1080 > 98.114.205.102.2152: Flags [.], cksum 0x796b (correct), seq 1, ack 8193, win 24820, length 0
00:28:34.882468 IP (tos 0x0, ttl 113, id 15837, offset 0, flags [DF], proto TCP (6), length 1500)
    98.114.205.102.2152 > 192.150.11.111.1080: Flags [.], cksum 0xa4f1 (correct), seq 8193:9653, ack 1, win 64240, length 1460
00:28:34.882486 IP (tos 0x0, ttl 64, id 46253, offset 0, flags [DF], proto TCP (6), length 40)
    192.150.11.111.1080 > 98.114.205.102.2152: Flags [.], cksum 0x684f (correct), seq 1, ack 9653, win 27740, length 0
00:28:34.884966 IP (tos 0x0, ttl 113, id 15838, offset 0, flags [DF], proto TCP (6), length 608)
    98.114.205.102.2152 > 192.150.11.111.1080: Flags [P.], cksum 0x7998 (correct), seq 9653:10221, ack 1, win 64240, length 568
00:28:34.884985 IP (tos 0x0, ttl 64, id 46254, offset 0, flags [DF], proto TCP (6), length 40)
    192.150.11.111.1080 > 98.114.205.102.2152: Flags [.], cksum 0x5aaf (correct), seq 1, ack 10221, win 30660, length 0
00:28:34.887216 IP (tos 0x0, ttl 113, id 15844, offset 0, flags [DF], proto TCP (6), length 60)
    98.114.205.102.2152 > 192.150.11.111.1080: Flags [P.], cksum 0x4b15 (correct), seq 10221:10241, ack 1, win 64240, length 20
00:28:34.887233 IP (tos 0x0, ttl 64, id 46255, offset 0, flags [DF], proto TCP (6), length 40)
    192.150.11.111.1080 > 98.114.205.102.2152: Flags [.], cksum 0x5a9b (correct), seq 1, ack 10241, win 30660, length 0
00:28:34.992281 IP (tos 0x0, ttl 113, id 15857, offset 0, flags [DF], proto TCP (6), length 1500)
    98.114.205.102.2152 > 192.150.11.111.1080: Flags [.], cksum 0xd740 (correct), seq 10241:11701, ack 1, win 64240, length 1460
00:28:34.992298 IP (tos 0x0, ttl 64, id 46256, offset 0, flags [DF], proto TCP (6), length 40)
    192.150.11.111.1080 > 98.114.205.102.2152: Flags [.], cksum 0x497f (correct), seq 1, ack 11701, win 33580, length 0
00:28:34.994905 IP (tos 0x0, ttl 113, id 15858, offset 0, flags [DF], proto TCP (6), length 628)
    98.114.205.102.2152 > 192.150.11.111.1080: Flags [P.], cksum 0xdd48 (correct), seq 11701:12289, ack 1, win 64240, length 588
00:28:34.994922 IP (tos 0x0, ttl 64, id 46257, offset 0, flags [DF], proto TCP (6), length 40)
    192.150.11.111.1080 > 98.114.205.102.2152: Flags [.], cksum 0x3bcb (correct), seq 1, ack 12289, win 36500, length 0
00:28:35.110591 IP (tos 0x0, ttl 113, id 15867, offset 0, flags [DF], proto TCP (6), length 1064)
    98.114.205.102.2152 > 192.150.11.111.1080: Flags [P.], cksum 0x764a (correct), seq 12289:13313, ack 1, win 64240, length 1024
00:28:35.110608 IP (tos 0x0, ttl 64, id 46258, offset 0, flags [DF], proto TCP (6), length 40)
    192.150.11.111.1080 > 98.114.205.102.2152: Flags [.], cksum 0x2c63 (correct), seq 1, ack 13313, win 39420, length 0
00:28:35.212409 IP (tos 0x0, ttl 113, id 15876, offset 0, flags [DF], proto TCP (6), length 1500)
    98.114.205.102.2152 > 192.150.11.111.1080: Flags [.], cksum 0x5729 (correct), seq 13313:14773, ack 1, win 64240, length 1460
00:28:35.212426 IP (tos 0x0, ttl 64, id 46259, offset 0, flags [DF], proto TCP (6), length 40)
    192.150.11.111.1080 > 98.114.205.102.2152: Flags [.], cksum 0x1b47 (correct), seq 1, ack 14773, win 42340, length 0
00:28:35.214907 IP (tos 0x0, ttl 113, id 15877, offset 0, flags [DF], proto TCP (6), length 628)
    98.114.205.102.2152 > 192.150.11.111.1080: Flags [P.], cksum 0xe3ff (correct), seq 14773:15361, ack 1, win 64240, length 588
00:28:35.214925 IP (tos 0x0, ttl 64, id 46260, offset 0, flags [DF], proto TCP (6), length 40)
    192.150.11.111.1080 > 98.114.205.102.2152: Flags [.], cksum 0x0d93 (correct), seq 1, ack 15361, win 45260, length 0
00:28:35.330468 IP (tos 0x0, ttl 113, id 15885, offset 0, flags [DF], proto TCP (6), length 1064)
    98.114.205.102.2152 > 192.150.11.111.1080: Flags [P.], cksum 0xd34c (correct), seq 15361:16385, ack 1, win 64240, length 1024
00:28:35.330485 IP (tos 0x0, ttl 64, id 46261, offset 0, flags [DF], proto TCP (6), length 40)
    192.150.11.111.1080 > 98.114.205.102.2152: Flags [.], cksum 0xfe2a (correct), seq 1, ack 16385, win 48180, length 0
00:28:35.414796 IP (tos 0x0, ttl 113, id 15906, offset 0, flags [DF], proto TCP (6), length 1500)
    98.114.205.102.2152 > 192.150.11.111.1080: Flags [.], cksum 0xf496 (correct), seq 16385:17845, ack 1, win 64240, length 1460
00:28:35.414813 IP (tos 0x0, ttl 64, id 46262, offset 0, flags [DF], proto TCP (6), length 40)
    192.150.11.111.1080 > 98.114.205.102.2152: Flags [.], cksum 0xed0e (correct), seq 1, ack 17845, win 51100, length 0
00:28:35.417419 IP (tos 0x0, ttl 113, id 15907, offset 0, flags [DF], proto TCP (6), length 628)
    98.114.205.102.2152 > 192.150.11.111.1080: Flags [P.], cksum 0x5238 (correct), seq 17845:18433, ack 1, win 64240, length 588
00:28:35.417437 IP (tos 0x0, ttl 64, id 46263, offset 0, flags [DF], proto TCP (6), length 40)
    192.150.11.111.1080 > 98.114.205.102.2152: Flags [.], cksum 0xdf5a (correct), seq 1, ack 18433, win 54020, length 0
00:28:35.492252 IP (tos 0x0, ttl 113, id 15914, offset 0, flags [DF], proto TCP (6), length 1500)
    98.114.205.102.2152 > 192.150.11.111.1080: Flags [.], cksum 0xf17a (correct), seq 18433:19893, ack 1, win 64240, length 1460
00:28:35.492269 IP (tos 0x0, ttl 64, id 46264, offset 0, flags [DF], proto TCP (6), length 40)
    192.150.11.111.1080 > 98.114.205.102.2152: Flags [.], cksum 0xce3e (correct), seq 1, ack 19893, win 56940, length 0
00:28:35.494877 IP (tos 0x0, ttl 113, id 15915, offset 0, flags [DF], proto TCP (6), length 628)
    98.114.205.102.2152 > 192.150.11.111.1080: Flags [P.], cksum 0x827c (correct), seq 19893:20481, ack 1, win 64240, length 588
00:28:35.494894 IP (tos 0x0, ttl 64, id 46265, offset 0, flags [DF], proto TCP (6), length 40)
    192.150.11.111.1080 > 98.114.205.102.2152: Flags [.], cksum 0xc08a (correct), seq 1, ack 20481, win 59860, length 0
00:28:35.610562 IP (tos 0x0, ttl 113, id 15919, offset 0, flags [DF], proto TCP (6), length 1064)
    98.114.205.102.2152 > 192.150.11.111.1080: Flags [P.], cksum 0xdc65 (correct), seq 20481:21505, ack 1, win 64240, length 1024
00:28:35.610580 IP (tos 0x0, ttl 64, id 46266, offset 0, flags [DF], proto TCP (6), length 40)
    192.150.11.111.1080 > 98.114.205.102.2152: Flags [.], cksum 0xb122 (correct), seq 1, ack 21505, win 62780, length 0
00:28:35.694765 IP (tos 0x0, ttl 113, id 15929, offset 0, flags [DF], proto TCP (6), length 1500)
    98.114.205.102.2152 > 192.150.11.111.1080: Flags [.], cksum 0xde0c (correct), seq 21505:22965, ack 1, win 64240, length 1460
00:28:35.694782 IP (tos 0x0, ttl 64, id 46267, offset 0, flags [DF], proto TCP (6), length 40)
    192.150.11.111.1080 > 98.114.205.102.2152: Flags [.], cksum 0xab6e (correct), seq 1, ack 22965, win 62780, length 0
00:28:35.697388 IP (tos 0x0, ttl 113, id 15930, offset 0, flags [DF], proto TCP (6), length 628)
    98.114.205.102.2152 > 192.150.11.111.1080: Flags [P.], cksum 0xa4d6 (correct), seq 22965:23553, ack 1, win 64240, length 588
00:28:35.697410 IP (tos 0x0, ttl 64, id 46268, offset 0, flags [DF], proto TCP (6), length 40)
    192.150.11.111.1080 > 98.114.205.102.2152: Flags [.], cksum 0xa922 (correct), seq 1, ack 23553, win 62780, length 0
00:28:35.820446 IP (tos 0x0, ttl 113, id 15939, offset 0, flags [DF], proto TCP (6), length 1064)
    98.114.205.102.2152 > 192.150.11.111.1080: Flags [P.], cksum 0xfdc4 (correct), seq 23553:24577, ack 1, win 64240, length 1024
00:28:35.820466 IP (tos 0x0, ttl 64, id 46269, offset 0, flags [DF], proto TCP (6), length 40)
    192.150.11.111.1080 > 98.114.205.102.2152: Flags [.], cksum 0xa522 (correct), seq 1, ack 24577, win 62780, length 0
00:28:35.943002 IP (tos 0x0, ttl 113, id 15948, offset 0, flags [DF], proto TCP (6), length 1064)
    98.114.205.102.2152 > 192.150.11.111.1080: Flags [P.], cksum 0x19e0 (correct), seq 24577:25601, ack 1, win 64240, length 1024
00:28:35.981990 IP (tos 0x0, ttl 64, id 46270, offset 0, flags [DF], proto TCP (6), length 40)
    192.150.11.111.1080 > 98.114.205.102.2152: Flags [.], cksum 0x9e5e (correct), seq 1, ack 25601, win 63488, length 0
00:28:35.994473 IP (tos 0x0, ttl 113, id 15963, offset 0, flags [DF], proto TCP (6), length 1500)
    98.114.205.102.2152 > 192.150.11.111.1080: Flags [.], cksum 0x16b9 (correct), seq 25601:27061, ack 1, win 64240, length 1460
00:28:35.997096 IP (tos 0x0, ttl 113, id 15964, offset 0, flags [DF], proto TCP (6), length 628)
    98.114.205.102.2152 > 192.150.11.111.1080: Flags [P.], cksum 0x4c28 (correct), seq 27061:27649, ack 1, win 64240, length 588
00:28:35.997112 IP (tos 0x0, ttl 64, id 46271, offset 0, flags [DF], proto TCP (6), length 40)
    192.150.11.111.1080 > 98.114.205.102.2152: Flags [.], cksum 0x965e (correct), seq 1, ack 27649, win 63488, length 0
00:28:36.130522 IP (tos 0x0, ttl 113, id 15979, offset 0, flags [DF], proto TCP (6), length 1064)
    98.114.205.102.2152 > 192.150.11.111.1080: Flags [P.], cksum 0x8024 (correct), seq 27649:28673, ack 1, win 64240, length 1024
00:28:36.130542 IP (tos 0x0, ttl 64, id 46272, offset 0, flags [DF], proto TCP (6), length 40)
    192.150.11.111.1080 > 98.114.205.102.2152: Flags [.], cksum 0x925e (correct), seq 1, ack 28673, win 63488, length 0
00:28:36.194861 IP (tos 0x0, ttl 113, id 15985, offset 0, flags [DF], proto TCP (6), length 1500)
    98.114.205.102.2152 > 192.150.11.111.1080: Flags [.], cksum 0xd11e (correct), seq 28673:30133, ack 1, win 64240, length 1460
00:28:36.197360 IP (tos 0x0, ttl 113, id 15986, offset 0, flags [DF], proto TCP (6), length 628)
    98.114.205.102.2152 > 192.150.11.111.1080: Flags [P.], cksum 0xeb6b (correct), seq 30133:30721, ack 1, win 64240, length 588
00:28:36.197376 IP (tos 0x0, ttl 64, id 46273, offset 0, flags [DF], proto TCP (6), length 40)
    192.150.11.111.1080 > 98.114.205.102.2152: Flags [.], cksum 0x8a5e (correct), seq 1, ack 30721, win 63488, length 0
00:28:36.255452 IP (tos 0x0, ttl 113, id 15988, offset 0, flags [DF], proto TCP (6), length 1064)
    98.114.205.102.2152 > 192.150.11.111.1080: Flags [P.], cksum 0xd1f0 (correct), seq 30721:31745, ack 1, win 64240, length 1024
00:28:36.255472 IP (tos 0x0, ttl 64, id 46274, offset 0, flags [DF], proto TCP (6), length 40)
    192.150.11.111.1080 > 98.114.205.102.2152: Flags [.], cksum 0x865e (correct), seq 1, ack 31745, win 63488, length 0
00:28:36.380632 IP (tos 0x0, ttl 113, id 15991, offset 0, flags [DF], proto TCP (6), length 1064)
    98.114.205.102.2152 > 192.150.11.111.1080: Flags [P.], cksum 0xda79 (correct), seq 31745:32769, ack 1, win 64240, length 1024
00:28:36.429730 IP (tos 0x0, ttl 113, id 16004, offset 0, flags [DF], proto TCP (6), length 1500)
    98.114.205.102.2152 > 192.150.11.111.1080: Flags [.], cksum 0x6bde (correct), seq 32769:34229, ack 1, win 64240, length 1460
00:28:36.429747 IP (tos 0x0, ttl 64, id 46275, offset 0, flags [DF], proto TCP (6), length 40)
    192.150.11.111.1080 > 98.114.205.102.2152: Flags [.], cksum 0x7caa (correct), seq 1, ack 34229, win 63488, length 0
00:28:36.432478 IP (tos 0x0, ttl 113, id 16005, offset 0, flags [DF], proto TCP (6), length 628)
    98.114.205.102.2152 > 192.150.11.111.1080: Flags [P.], cksum 0x96ba (correct), seq 34229:34817, ack 1, win 64240, length 588
00:28:36.432497 IP (tos 0x0, ttl 64, id 46276, offset 0, flags [DF], proto TCP (6), length 40)
    192.150.11.111.1080 > 98.114.205.102.2152: Flags [.], cksum 0x7a5e (correct), seq 1, ack 34817, win 63488, length 0
00:28:36.539795 IP (tos 0x0, ttl 113, id 16014, offset 0, flags [DF], proto TCP (6), length 1500)
    98.114.205.102.2152 > 192.150.11.111.1080: Flags [.], cksum 0x56b7 (correct), seq 34817:36277, ack 1, win 64240, length 1460
00:28:36.542418 IP (tos 0x0, ttl 113, id 16015, offset 0, flags [DF], proto TCP (6), length 628)
    98.114.205.102.2152 > 192.150.11.111.1080: Flags [P.], cksum 0xcb0b (correct), seq 36277:36865, ack 1, win 64240, length 588
00:28:36.542433 IP (tos 0x0, ttl 64, id 46277, offset 0, flags [DF], proto TCP (6), length 40)
    192.150.11.111.1080 > 98.114.205.102.2152: Flags [.], cksum 0x725e (correct), seq 1, ack 36865, win 63488, length 0
00:28:36.668098 IP (tos 0x0, ttl 113, id 16021, offset 0, flags [DF], proto TCP (6), length 1064)
    98.114.205.102.2152 > 192.150.11.111.1080: Flags [P.], cksum 0xb306 (correct), seq 36865:37889, ack 1, win 64240, length 1024
00:28:36.668117 IP (tos 0x0, ttl 64, id 46278, offset 0, flags [DF], proto TCP (6), length 40)
    192.150.11.111.1080 > 98.114.205.102.2152: Flags [.], cksum 0x6e5e (correct), seq 1, ack 37889, win 63488, length 0
00:28:36.789905 IP (tos 0x0, ttl 113, id 16027, offset 0, flags [DF], proto TCP (6), length 1500)
    98.114.205.102.2152 > 192.150.11.111.1080: Flags [.], cksum 0x1284 (correct), seq 37889:39349, ack 1, win 64240, length 1460
00:28:36.792404 IP (tos 0x0, ttl 113, id 16028, offset 0, flags [DF], proto TCP (6), length 628)
    98.114.205.102.2152 > 192.150.11.111.1080: Flags [P.], cksum 0x9530 (correct), seq 39349:39937, ack 1, win 64240, length 588
00:28:36.792419 IP (tos 0x0, ttl 64, id 46279, offset 0, flags [DF], proto TCP (6), length 40)
    192.150.11.111.1080 > 98.114.205.102.2152: Flags [.], cksum 0x665e (correct), seq 1, ack 39937, win 63488, length 0
00:28:36.882229 IP (tos 0x0, ttl 113, id 16040, offset 0, flags [DF], proto TCP (6), length 1500)
    98.114.205.102.2152 > 192.150.11.111.1080: Flags [.], cksum 0x5635 (correct), seq 39937:41397, ack 1, win 64240, length 1460
00:28:36.884852 IP (tos 0x0, ttl 113, id 16041, offset 0, flags [DF], proto TCP (6), length 628)
    98.114.205.102.2152 > 192.150.11.111.1080: Flags [P.], cksum 0x63c9 (correct), seq 41397:41985, ack 1, win 64240, length 588
00:28:36.884868 IP (tos 0x0, ttl 64, id 46280, offset 0, flags [DF], proto TCP (6), length 40)
    192.150.11.111.1080 > 98.114.205.102.2152: Flags [.], cksum 0x5e5e (correct), seq 1, ack 41985, win 63488, length 0
00:28:36.915459 IP (tos 0x0, ttl 113, id 16045, offset 0, flags [DF], proto TCP (6), length 1064)
    98.114.205.102.2152 > 192.150.11.111.1080: Flags [P.], cksum 0xebdc (correct), seq 41985:43009, ack 1, win 64240, length 1024
00:28:36.915479 IP (tos 0x0, ttl 64, id 46281, offset 0, flags [DF], proto TCP (6), length 40)
    192.150.11.111.1080 > 98.114.205.102.2152: Flags [.], cksum 0x5a5e (correct), seq 1, ack 43009, win 63488, length 0
00:28:37.008033 IP (tos 0x0, ttl 113, id 16061, offset 0, flags [DF], proto TCP (6), length 1064)
    98.114.205.102.2152 > 192.150.11.111.1080: Flags [P.], cksum 0x5665 (correct), seq 43009:44033, ack 1, win 64240, length 1024
00:28:37.058017 IP (tos 0x0, ttl 64, id 46282, offset 0, flags [DF], proto TCP (6), length 40)
    192.150.11.111.1080 > 98.114.205.102.2152: Flags [.], cksum 0x565e (correct), seq 1, ack 44033, win 63488, length 0
00:28:37.149829 IP (tos 0x0, ttl 113, id 16064, offset 0, flags [DF], proto TCP (6), length 1500)
    98.114.205.102.2152 > 192.150.11.111.1080: Flags [.], cksum 0x7291 (correct), seq 44033:45493, ack 1, win 64240, length 1460
00:28:37.152453 IP (tos 0x0, ttl 113, id 16065, offset 0, flags [DF], proto TCP (6), length 628)
    98.114.205.102.2152 > 192.150.11.111.1080: Flags [P.], cksum 0x6bb5 (correct), seq 45493:46081, ack 1, win 64240, length 588
00:28:37.152468 IP (tos 0x0, ttl 64, id 46283, offset 0, flags [DF], proto TCP (6), length 40)
    192.150.11.111.1080 > 98.114.205.102.2152: Flags [.], cksum 0x4e5e (correct), seq 1, ack 46081, win 63488, length 0
00:28:37.275010 IP (tos 0x0, ttl 113, id 16070, offset 0, flags [DF], proto TCP (6), length 1500)
    98.114.205.102.2152 > 192.150.11.111.1080: Flags [.], cksum 0xac8c (correct), seq 46081:47541, ack 1, win 64240, length 1460
00:28:37.277633 IP (tos 0x0, ttl 113, id 16071, offset 0, flags [DF], proto TCP (6), length 628)
    98.114.205.102.2152 > 192.150.11.111.1080: Flags [P.], cksum 0x09c4 (correct), seq 47541:48129, ack 1, win 64240, length 588
00:28:37.277649 IP (tos 0x0, ttl 64, id 46284, offset 0, flags [DF], proto TCP (6), length 40)
    192.150.11.111.1080 > 98.114.205.102.2152: Flags [.], cksum 0x465e (correct), seq 1, ack 48129, win 63488, length 0
00:28:37.400814 IP (tos 0x0, ttl 113, id 16088, offset 0, flags [DF], proto TCP (6), length 1064)
    98.114.205.102.2152 > 192.150.11.111.1080: Flags [P.], cksum 0xea17 (correct), seq 48129:49153, ack 1, win 64240, length 1024
00:28:37.400833 IP (tos 0x0, ttl 64, id 46285, offset 0, flags [DF], proto TCP (6), length 40)
    192.150.11.111.1080 > 98.114.205.102.2152: Flags [.], cksum 0x425e (correct), seq 1, ack 49153, win 63488, length 0
00:28:37.460031 IP (tos 0x0, ttl 113, id 16097, offset 0, flags [DF], proto TCP (6), length 1500)
    98.114.205.102.2152 > 192.150.11.111.1080: Flags [.], cksum 0x299f (correct), seq 49153:50613, ack 1, win 64240, length 1460
00:28:37.462655 IP (tos 0x0, ttl 113, id 16098, offset 0, flags [DF], proto TCP (6), length 628)
    98.114.205.102.2152 > 192.150.11.111.1080: Flags [P.], cksum 0x03a8 (correct), seq 50613:51201, ack 1, win 64240, length 588
00:28:37.462670 IP (tos 0x0, ttl 64, id 46286, offset 0, flags [DF], proto TCP (6), length 40)
    192.150.11.111.1080 > 98.114.205.102.2152: Flags [.], cksum 0x3a5e (correct), seq 1, ack 51201, win 63488, length 0
00:28:37.585461 IP (tos 0x0, ttl 113, id 16104, offset 0, flags [DF], proto TCP (6), length 1064)
    98.114.205.102.2152 > 192.150.11.111.1080: Flags [P.], cksum 0x3d0a (correct), seq 51201:52225, ack 1, win 64240, length 1024
00:28:37.585481 IP (tos 0x0, ttl 64, id 46287, offset 0, flags [DF], proto TCP (6), length 40)
    192.150.11.111.1080 > 98.114.205.102.2152: Flags [.], cksum 0x365e (correct), seq 1, ack 52225, win 63488, length 0
00:28:37.664792 IP (tos 0x0, ttl 113, id 16118, offset 0, flags [DF], proto TCP (6), length 1500)
    98.114.205.102.2152 > 192.150.11.111.1080: Flags [.], cksum 0x9a09 (correct), seq 52225:53685, ack 1, win 64240, length 1460
00:28:37.667416 IP (tos 0x0, ttl 113, id 16119, offset 0, flags [DF], proto TCP (6), length 628)
    98.114.205.102.2152 > 192.150.11.111.1080: Flags [P.], cksum 0x94ed (correct), seq 53685:54273, ack 1, win 64240, length 588
00:28:37.667431 IP (tos 0x0, ttl 64, id 46288, offset 0, flags [DF], proto TCP (6), length 40)
    192.150.11.111.1080 > 98.114.205.102.2152: Flags [.], cksum 0x2e5e (correct), seq 1, ack 54273, win 63488, length 0
00:28:37.708018 IP (tos 0x0, ttl 113, id 16121, offset 0, flags [DF], proto TCP (6), length 1064)
    98.114.205.102.2152 > 192.150.11.111.1080: Flags [P.], cksum 0x1028 (correct), seq 54273:55297, ack 1, win 64240, length 1024
00:28:37.708037 IP (tos 0x0, ttl 64, id 46289, offset 0, flags [DF], proto TCP (6), length 40)
    192.150.11.111.1080 > 98.114.205.102.2152: Flags [.], cksum 0x2a5e (correct), seq 1, ack 55297, win 63488, length 0
00:28:37.833075 IP (tos 0x0, ttl 113, id 16128, offset 0, flags [DF], proto TCP (6), length 1064)
    98.114.205.102.2152 > 192.150.11.111.1080: Flags [P.], cksum 0xc3fd (correct), seq 55297:56321, ack 1, win 64240, length 1024
00:28:37.890039 IP (tos 0x0, ttl 64, id 46290, offset 0, flags [DF], proto TCP (6), length 40)
    192.150.11.111.1080 > 98.114.205.102.2152: Flags [.], cksum 0x265e (correct), seq 1, ack 56321, win 63488, length 0
00:28:37.929770 IP (tos 0x0, ttl 113, id 16138, offset 0, flags [DF], proto TCP (6), length 1500)
    98.114.205.102.2152 > 192.150.11.111.1080: Flags [.], cksum 0x551f (correct), seq 56321:57781, ack 1, win 64240, length 1460
00:28:37.932518 IP (tos 0x0, ttl 113, id 16139, offset 0, flags [DF], proto TCP (6), length 628)
    98.114.205.102.2152 > 192.150.11.111.1080: Flags [P.], cksum 0xf4e6 (correct), seq 57781:58369, ack 1, win 64240, length 588
00:28:37.932534 IP (tos 0x0, ttl 64, id 46291, offset 0, flags [DF], proto TCP (6), length 40)
    192.150.11.111.1080 > 98.114.205.102.2152: Flags [.], cksum 0x1e5e (correct), seq 1, ack 58369, win 63488, length 0
00:28:38.012474 IP (tos 0x0, ttl 113, id 16153, offset 0, flags [DF], proto TCP (6), length 1500)
    98.114.205.102.2152 > 192.150.11.111.1080: Flags [.], cksum 0x5d09 (correct), seq 58369:59829, ack 1, win 64240, length 1460
00:28:38.015097 IP (tos 0x0, ttl 113, id 16154, offset 0, flags [DF], proto TCP (6), length 628)
    98.114.205.102.2152 > 192.150.11.111.1080: Flags [P.], cksum 0xad6f (correct), seq 59829:60417, ack 1, win 64240, length 588
00:28:38.015113 IP (tos 0x0, ttl 64, id 46292, offset 0, flags [DF], proto TCP (6), length 40)
    192.150.11.111.1080 > 98.114.205.102.2152: Flags [.], cksum 0x165e (correct), seq 1, ack 60417, win 63488, length 0
00:28:38.138031 IP (tos 0x0, ttl 113, id 16162, offset 0, flags [DF], proto TCP (6), length 1064)
    98.114.205.102.2152 > 192.150.11.111.1080: Flags [P.], cksum 0x8423 (correct), seq 60417:61441, ack 1, win 64240, length 1024
00:28:38.138050 IP (tos 0x0, ttl 64, id 46293, offset 0, flags [DF], proto TCP (6), length 40)
    192.150.11.111.1080 > 98.114.205.102.2152: Flags [.], cksum 0x125e (correct), seq 1, ack 61441, win 63488, length 0
00:28:38.259960 IP (tos 0x0, ttl 113, id 16171, offset 0, flags [DF], proto TCP (6), length 1500)
    98.114.205.102.2152 > 192.150.11.111.1080: Flags [.], cksum 0x6ab3 (correct), seq 61441:62901, ack 1, win 64240, length 1460
00:28:38.262459 IP (tos 0x0, ttl 113, id 16172, offset 0, flags [DF], proto TCP (6), length 628)
    98.114.205.102.2152 > 192.150.11.111.1080: Flags [P.], cksum 0x4898 (correct), seq 62901:63489, ack 1, win 64240, length 588
00:28:38.262475 IP (tos 0x0, ttl 64, id 46294, offset 0, flags [DF], proto TCP (6), length 40)
    192.150.11.111.1080 > 98.114.205.102.2152: Flags [.], cksum 0x0a5e (correct), seq 1, ack 63489, win 63488, length 0
00:28:38.384890 IP (tos 0x0, ttl 113, id 16178, offset 0, flags [DF], proto TCP (6), length 1500)
    98.114.205.102.2152 > 192.150.11.111.1080: Flags [.], cksum 0x6f1e (correct), seq 63489:64949, ack 1, win 64240, length 1460
00:28:38.387389 IP (tos 0x0, ttl 113, id 16179, offset 0, flags [DF], proto TCP (6), length 628)
    98.114.205.102.2152 > 192.150.11.111.1080: Flags [P.], cksum 0xe290 (correct), seq 64949:65537, ack 1, win 64240, length 588
00:28:38.387405 IP (tos 0x0, ttl 64, id 46295, offset 0, flags [DF], proto TCP (6), length 40)
    192.150.11.111.1080 > 98.114.205.102.2152: Flags [.], cksum 0x025e (correct), seq 1, ack 65537, win 63488, length 0
00:28:38.462473 IP (tos 0x0, ttl 113, id 16193, offset 0, flags [DF], proto TCP (6), length 1500)
    98.114.205.102.2152 > 192.150.11.111.1080: Flags [.], cksum 0x5ce3 (correct), seq 65537:66997, ack 1, win 64240, length 1460
00:28:38.464846 IP (tos 0x0, ttl 113, id 16194, offset 0, flags [DF], proto TCP (6), length 628)
    98.114.205.102.2152 > 192.150.11.111.1080: Flags [P.], cksum 0xc92f (correct), seq 66997:67585, ack 1, win 64240, length 588
00:28:38.464861 IP (tos 0x0, ttl 64, id 46296, offset 0, flags [DF], proto TCP (6), length 40)
    192.150.11.111.1080 > 98.114.205.102.2152: Flags [.], cksum 0xfa5d (correct), seq 1, ack 67585, win 63488, length 0
00:28:38.588153 IP (tos 0x0, ttl 113, id 16200, offset 0, flags [DF], proto TCP (6), length 1064)
    98.114.205.102.2152 > 192.150.11.111.1080: Flags [P.], cksum 0xc364 (correct), seq 67585:68609, ack 1, win 64240, length 1024
00:28:38.588173 IP (tos 0x0, ttl 64, id 46297, offset 0, flags [DF], proto TCP (6), length 40)
    192.150.11.111.1080 > 98.114.205.102.2152: Flags [.], cksum 0xf65d (correct), seq 1, ack 68609, win 63488, length 0
00:28:38.647371 IP (tos 0x0, ttl 113, id 16209, offset 0, flags [DF], proto TCP (6), length 1500)
    98.114.205.102.2152 > 192.150.11.111.1080: Flags [.], cksum 0x18de (correct), seq 68609:70069, ack 1, win 64240, length 1460
00:28:38.649993 IP (tos 0x0, ttl 113, id 16210, offset 0, flags [DF], proto TCP (6), length 628)
    98.114.205.102.2152 > 192.150.11.111.1080: Flags [P.], cksum 0x6e44 (correct), seq 70069:70657, ack 1, win 64240, length 588
00:28:38.650009 IP (tos 0x0, ttl 64, id 46298, offset 0, flags [DF], proto TCP (6), length 40)
    192.150.11.111.1080 > 98.114.205.102.2152: Flags [.], cksum 0xee5d (correct), seq 1, ack 70657, win 63488, length 0
00:28:38.713209 IP (tos 0x0, ttl 113, id 16220, offset 0, flags [DF], proto TCP (6), length 1064)
    98.114.205.102.2152 > 192.150.11.111.1080: Flags [P.], cksum 0x0e4a (correct), seq 70657:71681, ack 1, win 64240, length 1024
00:28:38.713229 IP (tos 0x0, ttl 64, id 46299, offset 0, flags [DF], proto TCP (6), length 40)
    192.150.11.111.1080 > 98.114.205.102.2152: Flags [.], cksum 0xea5d (correct), seq 1, ack 71681, win 63488, length 0
00:28:38.838014 IP (tos 0x0, ttl 113, id 16228, offset 0, flags [DF], proto TCP (6), length 1064)
    98.114.205.102.2152 > 192.150.11.111.1080: Flags [P.], cksum 0xc81c (correct), seq 71681:72705, ack 1, win 64240, length 1024
00:28:38.878065 IP (tos 0x0, ttl 64, id 46300, offset 0, flags [DF], proto TCP (6), length 40)
    192.150.11.111.1080 > 98.114.205.102.2152: Flags [.], cksum 0xe65d (correct), seq 1, ack 72705, win 63488, length 0
00:28:38.929962 IP (tos 0x0, ttl 113, id 16242, offset 0, flags [DF], proto TCP (6), length 1500)
    98.114.205.102.2152 > 192.150.11.111.1080: Flags [.], cksum 0xa6ed (correct), seq 72705:74165, ack 1, win 64240, length 1460
00:28:38.932461 IP (tos 0x0, ttl 113, id 16243, offset 0, flags [DF], proto TCP (6), length 628)
    98.114.205.102.2152 > 192.150.11.111.1080: Flags [P.], cksum 0x0f11 (correct), seq 74165:74753, ack 1, win 64240, length 588
00:28:38.932477 IP (tos 0x0, ttl 64, id 46301, offset 0, flags [DF], proto TCP (6), length 40)
    192.150.11.111.1080 > 98.114.205.102.2152: Flags [.], cksum 0xde5d (correct), seq 1, ack 74753, win 63488, length 0
00:28:39.058265 IP (tos 0x0, ttl 113, id 16255, offset 0, flags [DF], proto TCP (6), length 1064)
    98.114.205.102.2152 > 192.150.11.111.1080: Flags [P.], cksum 0xf442 (correct), seq 74753:75777, ack 1, win 64240, length 1024
00:28:39.058284 IP (tos 0x0, ttl 64, id 46302, offset 0, flags [DF], proto TCP (6), length 40)
    192.150.11.111.1080 > 98.114.205.102.2152: Flags [.], cksum 0xda5d (correct), seq 1, ack 75777, win 63488, length 0
00:28:39.149840 IP (tos 0x0, ttl 113, id 16266, offset 0, flags [DF], proto TCP (6), length 1500)
    98.114.205.102.2152 > 192.150.11.111.1080: Flags [.], cksum 0xe75c (correct), seq 75777:77237, ack 1, win 64240, length 1460
00:28:39.152463 IP (tos 0x0, ttl 113, id 16267, offset 0, flags [DF], proto TCP (6), length 628)
    98.114.205.102.2152 > 192.150.11.111.1080: Flags [P.], cksum 0x47ab (correct), seq 77237:77825, ack 1, win 64240, length 588
00:28:39.152479 IP (tos 0x0, ttl 64, id 46303, offset 0, flags [DF], proto TCP (6), length 40)
    192.150.11.111.1080 > 98.114.205.102.2152: Flags [.], cksum 0xd25d (correct), seq 1, ack 77825, win 63488, length 0
00:28:39.278018 IP (tos 0x0, ttl 113, id 16275, offset 0, flags [DF], proto TCP (6), length 1064)
    98.114.205.102.2152 > 192.150.11.111.1080: Flags [P.], cksum 0x343c (correct), seq 77825:78849, ack 1, win 64240, length 1024
00:28:39.278037 IP (tos 0x0, ttl 64, id 46304, offset 0, flags [DF], proto TCP (6), length 40)
    192.150.11.111.1080 > 98.114.205.102.2152: Flags [.], cksum 0xce5d (correct), seq 1, ack 78849, win 63488, length 0
00:28:39.367344 IP (tos 0x0, ttl 113, id 16279, offset 0, flags [DF], proto TCP (6), length 1500)
    98.114.205.102.2152 > 192.150.11.111.1080: Flags [.], cksum 0x2173 (correct), seq 78849:80309, ack 1, win 64240, length 1460
00:28:39.369842 IP (tos 0x0, ttl 113, id 16280, offset 0, flags [DF], proto TCP (6), length 628)
    98.114.205.102.2152 > 192.150.11.111.1080: Flags [P.], cksum 0x7174 (correct), seq 80309:80897, ack 1, win 64240, length 588
00:28:39.369859 IP (tos 0x0, ttl 64, id 46305, offset 0, flags [DF], proto TCP (6), length 40)
    192.150.11.111.1080 > 98.114.205.102.2152: Flags [.], cksum 0xc65d (correct), seq 1, ack 80897, win 63488, length 0
00:28:39.495648 IP (tos 0x0, ttl 113, id 16306, offset 0, flags [DF], proto TCP (6), length 1064)
    98.114.205.102.2152 > 192.150.11.111.1080: Flags [P.], cksum 0x96c3 (correct), seq 80897:81921, ack 1, win 64240, length 1024
00:28:39.495667 IP (tos 0x0, ttl 64, id 46306, offset 0, flags [DF], proto TCP (6), length 40)
    192.150.11.111.1080 > 98.114.205.102.2152: Flags [.], cksum 0xc25d (correct), seq 1, ack 81921, win 63488, length 0
00:28:39.602337 IP (tos 0x0, ttl 113, id 16311, offset 0, flags [DF], proto TCP (6), length 1500)
    98.114.205.102.2152 > 192.150.11.111.1080: Flags [.], cksum 0xe76b (correct), seq 81921:83381, ack 1, win 64240, length 1460
00:28:39.604961 IP (tos 0x0, ttl 113, id 16312, offset 0, flags [DF], proto TCP (6), length 628)
    98.114.205.102.2152 > 192.150.11.111.1080: Flags [P.], cksum 0x0f59 (correct), seq 83381:83969, ack 1, win 64240, length 588
00:28:39.604977 IP (tos 0x0, ttl 64, id 46307, offset 0, flags [DF], proto TCP (6), length 40)
    192.150.11.111.1080 > 98.114.205.102.2152: Flags [.], cksum 0xba5d (correct), seq 1, ack 83969, win 63488, length 0
00:28:39.695036 IP (tos 0x0, ttl 113, id 16316, offset 0, flags [DF], proto TCP (6), length 1500)
    98.114.205.102.2152 > 192.150.11.111.1080: Flags [.], cksum 0x4b99 (correct), seq 83969:85429, ack 1, win 64240, length 1460
00:28:39.697409 IP (tos 0x0, ttl 113, id 16317, offset 0, flags [DF], proto TCP (6), length 628)
    98.114.205.102.2152 > 192.150.11.111.1080: Flags [P.], cksum 0x25ce (correct), seq 85429:86017, ack 1, win 64240, length 588
00:28:39.697425 IP (tos 0x0, ttl 64, id 46308, offset 0, flags [DF], proto TCP (6), length 40)
    192.150.11.111.1080 > 98.114.205.102.2152: Flags [.], cksum 0xb25d (correct), seq 1, ack 86017, win 63488, length 0
00:28:39.823090 IP (tos 0x0, ttl 113, id 16326, offset 0, flags [DF], proto TCP (6), length 1064)
    98.114.205.102.2152 > 192.150.11.111.1080: Flags [P.], cksum 0x3724 (correct), seq 86017:87041, ack 1, win 64240, length 1024
00:28:39.823111 IP (tos 0x0, ttl 64, id 46309, offset 0, flags [DF], proto TCP (6), length 40)
    192.150.11.111.1080 > 98.114.205.102.2152: Flags [.], cksum 0xae5d (correct), seq 1, ack 87041, win 63488, length 0
00:28:39.899797 IP (tos 0x0, ttl 113, id 16330, offset 0, flags [DF], proto TCP (6), length 1500)
    98.114.205.102.2152 > 192.150.11.111.1080: Flags [.], cksum 0xa1ec (correct), seq 87041:88501, ack 1, win 64240, length 1460
00:28:39.902420 IP (tos 0x0, ttl 113, id 16331, offset 0, flags [DF], proto TCP (6), length 628)
    98.114.205.102.2152 > 192.150.11.111.1080: Flags [P.], cksum 0x19ea (correct), seq 88501:89089, ack 1, win 64240, length 588
00:28:39.902436 IP (tos 0x0, ttl 64, id 46310, offset 0, flags [DF], proto TCP (6), length 40)
    192.150.11.111.1080 > 98.114.205.102.2152: Flags [.], cksum 0xa65d (correct), seq 1, ack 89089, win 63488, length 0
00:28:40.025601 IP (tos 0x0, ttl 113, id 16346, offset 0, flags [DF], proto TCP (6), length 1064)
    98.114.205.102.2152 > 192.150.11.111.1080: Flags [P.], cksum 0xed3a (correct), seq 89089:90113, ack 1, win 64240, length 1024
00:28:40.025621 IP (tos 0x0, ttl 64, id 46311, offset 0, flags [DF], proto TCP (6), length 40)
    192.150.11.111.1080 > 98.114.205.102.2152: Flags [.], cksum 0xa25d (correct), seq 1, ack 90113, win 63488, length 0
00:28:40.132541 IP (tos 0x0, ttl 113, id 16358, offset 0, flags [DF], proto TCP (6), length 1500)
    98.114.205.102.2152 > 192.150.11.111.1080: Flags [.], cksum 0x7886 (correct), seq 90113:91573, ack 1, win 64240, length 1460
00:28:40.135041 IP (tos 0x0, ttl 113, id 16359, offset 0, flags [DF], proto TCP (6), length 628)
    98.114.205.102.2152 > 192.150.11.111.1080: Flags [P.], cksum 0x99ad (correct), seq 91573:92161, ack 1, win 64240, length 588
00:28:40.135057 IP (tos 0x0, ttl 64, id 46312, offset 0, flags [DF], proto TCP (6), length 40)
    192.150.11.111.1080 > 98.114.205.102.2152: Flags [.], cksum 0x9a5d (correct), seq 1, ack 92161, win 63488, length 0
00:28:40.227364 IP (tos 0x0, ttl 113, id 16361, offset 0, flags [DF], proto TCP (6), length 1500)
    98.114.205.102.2152 > 192.150.11.111.1080: Flags [.], cksum 0x1ea0 (correct), seq 92161:93621, ack 1, win 64240, length 1460
00:28:40.229863 IP (tos 0x0, ttl 113, id 16362, offset 0, flags [DF], proto TCP (6), length 628)
    98.114.205.102.2152 > 192.150.11.111.1080: Flags [P.], cksum 0x1ffc (correct), seq 93621:94209, ack 1, win 64240, length 588
00:28:40.229879 IP (tos 0x0, ttl 64, id 46313, offset 0, flags [DF], proto TCP (6), length 40)
    192.150.11.111.1080 > 98.114.205.102.2152: Flags [.], cksum 0x925d (correct), seq 1, ack 94209, win 63488, length 0
00:28:40.352295 IP (tos 0x0, ttl 113, id 16372, offset 0, flags [DF], proto TCP (6), length 1500)
    98.114.205.102.2152 > 192.150.11.111.1080: Flags [.], cksum 0xd77c (correct), seq 94209:95669, ack 1, win 64240, length 1460
00:28:40.354918 IP (tos 0x0, ttl 113, id 16373, offset 0, flags [DF], proto TCP (6), length 628)
    98.114.205.102.2152 > 192.150.11.111.1080: Flags [P.], cksum 0x5b23 (correct), seq 95669:96257, ack 1, win 64240, length 588
00:28:40.354934 IP (tos 0x0, ttl 64, id 46314, offset 0, flags [DF], proto TCP (6), length 40)
    192.150.11.111.1080 > 98.114.205.102.2152: Flags [.], cksum 0x8a5d (correct), seq 1, ack 96257, win 63488, length 0
00:28:40.430001 IP (tos 0x0, ttl 113, id 16386, offset 0, flags [DF], proto TCP (6), length 1500)
    98.114.205.102.2152 > 192.150.11.111.1080: Flags [.], cksum 0x90f0 (correct), seq 96257:97717, ack 1, win 64240, length 1460
00:28:40.432500 IP (tos 0x0, ttl 113, id 16387, offset 0, flags [DF], proto TCP (6), length 628)
    98.114.205.102.2152 > 192.150.11.111.1080: Flags [P.], cksum 0xe6b2 (correct), seq 97717:98305, ack 1, win 64240, length 588
00:28:40.432515 IP (tos 0x0, ttl 64, id 46315, offset 0, flags [DF], proto TCP (6), length 40)
    192.150.11.111.1080 > 98.114.205.102.2152: Flags [.], cksum 0x825d (correct), seq 1, ack 98305, win 63488, length 0
00:28:40.480598 IP (tos 0x0, ttl 113, id 16390, offset 0, flags [DF], proto TCP (6), length 1064)
    98.114.205.102.2152 > 192.150.11.111.1080: Flags [P.], cksum 0xd214 (correct), seq 98305:99329, ack 1, win 64240, length 1024
00:28:40.480617 IP (tos 0x0, ttl 64, id 46316, offset 0, flags [DF], proto TCP (6), length 40)
    192.150.11.111.1080 > 98.114.205.102.2152: Flags [.], cksum 0x7e5d (correct), seq 1, ack 99329, win 63488, length 0
00:28:40.558180 IP (tos 0x0, ttl 113, id 16398, offset 0, flags [DF], proto TCP (6), length 1064)
    98.114.205.102.2152 > 192.150.11.111.1080: Flags [P.], cksum 0xc03c (correct), seq 99329:100353, ack 1, win 64240, length 1024
00:28:40.598109 IP (tos 0x0, ttl 64, id 46317, offset 0, flags [DF], proto TCP (6), length 40)
    192.150.11.111.1080 > 98.114.205.102.2152: Flags [.], cksum 0x7a5d (correct), seq 1, ack 100353, win 63488, length 0
00:28:40.722963 IP (tos 0x0, ttl 113, id 16411, offset 0, flags [DF], proto TCP (6), length 1064)
    98.114.205.102.2152 > 192.150.11.111.1080: Flags [P.], cksum 0x397b (correct), seq 100353:101377, ack 1, win 64240, length 1024
00:28:40.802115 IP (tos 0x0, ttl 64, id 46318, offset 0, flags [DF], proto TCP (6), length 40)
    192.150.11.111.1080 > 98.114.205.102.2152: Flags [.], cksum 0x765d (correct), seq 1, ack 101377, win 63488, length 0
00:28:40.866009 IP (tos 0x0, ttl 113, id 16429, offset 0, flags [DF], proto TCP (6), length 1500)
    98.114.205.102.2152 > 192.150.11.111.1080: Flags [.], cksum 0xca55 (correct), seq 101377:102837, ack 1, win 64240, length 1460
00:28:40.868632 IP (tos 0x0, ttl 113, id 16430, offset 0, flags [DF], proto TCP (6), length 628)
    98.114.205.102.2152 > 192.150.11.111.1080: Flags [P.], cksum 0xa679 (correct), seq 102837:103425, ack 1, win 64240, length 588
00:28:40.868649 IP (tos 0x0, ttl 64, id 46319, offset 0, flags [DF], proto TCP (6), length 40)
    192.150.11.111.1080 > 98.114.205.102.2152: Flags [.], cksum 0x6e5d (correct), seq 1, ack 103425, win 63488, length 0
00:28:40.925475 IP (tos 0x0, ttl 113, id 16439, offset 0, flags [DF], proto TCP (6), length 1064)
    98.114.205.102.2152 > 192.150.11.111.1080: Flags [P.], cksum 0x19b1 (correct), seq 103425:104449, ack 1, win 64240, length 1024
00:28:40.925494 IP (tos 0x0, ttl 64, id 46320, offset 0, flags [DF], proto TCP (6), length 40)
    192.150.11.111.1080 > 98.114.205.102.2152: Flags [.], cksum 0x6a5d (correct), seq 1, ack 104449, win 63488, length 0
00:28:41.048032 IP (tos 0x0, ttl 113, id 16450, offset 0, flags [DF], proto TCP (6), length 1064)
    98.114.205.102.2152 > 192.150.11.111.1080: Flags [P.], cksum 0x7c91 (correct), seq 104449:105473, ack 1, win 64240, length 1024
00:28:41.132360 IP (tos 0x0, ttl 113, id 16460, offset 0, flags [DF], proto TCP (6), length 1500)
    98.114.205.102.2152 > 192.150.11.111.1080: Flags [.], cksum 0xfe95 (correct), seq 105473:106933, ack 1, win 64240, length 1460
00:28:41.132376 IP (tos 0x0, ttl 64, id 46321, offset 0, flags [DF], proto TCP (6), length 40)
    192.150.11.111.1080 > 98.114.205.102.2152: Flags [.], cksum 0x60a9 (correct), seq 1, ack 106933, win 63488, length 0
00:28:41.134859 IP (tos 0x0, ttl 113, id 16461, offset 0, flags [DF], proto TCP (6), length 628)
    98.114.205.102.2152 > 192.150.11.111.1080: Flags [P.], cksum 0xefac (correct), seq 106933:107521, ack 1, win 64240, length 588
00:28:41.134877 IP (tos 0x0, ttl 64, id 46322, offset 0, flags [DF], proto TCP (6), length 40)
    192.150.11.111.1080 > 98.114.205.102.2152: Flags [.], cksum 0x5e5d (correct), seq 1, ack 107521, win 63488, length 0
00:28:41.253042 IP (tos 0x0, ttl 113, id 16471, offset 0, flags [DF], proto TCP (6), length 1064)
    98.114.205.102.2152 > 192.150.11.111.1080: Flags [P.], cksum 0x3c43 (correct), seq 107521:108545, ack 1, win 64240, length 1024
00:28:41.253062 IP (tos 0x0, ttl 64, id 46323, offset 0, flags [DF], proto TCP (6), length 40)
    192.150.11.111.1080 > 98.114.205.102.2152: Flags [.], cksum 0x5a5d (correct), seq 1, ack 108545, win 63488, length 0
00:28:41.334748 IP (tos 0x0, ttl 113, id 16479, offset 0, flags [DF], proto TCP (6), length 1500)
    98.114.205.102.2152 > 192.150.11.111.1080: Flags [.], cksum 0xfb51 (correct), seq 108545:110005, ack 1, win 64240, length 1460
00:28:41.337371 IP (tos 0x0, ttl 113, id 16480, offset 0, flags [DF], proto TCP (6), length 628)
    98.114.205.102.2152 > 192.150.11.111.1080: Flags [P.], cksum 0xe197 (correct), seq 110005:110593, ack 1, win 64240, length 588
00:28:41.337388 IP (tos 0x0, ttl 64, id 46324, offset 0, flags [DF], proto TCP (6), length 40)
    192.150.11.111.1080 > 98.114.205.102.2152: Flags [.], cksum 0x525d (correct), seq 1, ack 110593, win 63488, length 0
00:28:41.375475 IP (tos 0x0, ttl 113, id 16481, offset 0, flags [DF], proto TCP (6), length 1064)
    98.114.205.102.2152 > 192.150.11.111.1080: Flags [P.], cksum 0x6450 (correct), seq 110593:111617, ack 1, win 64240, length 1024
00:28:41.375494 IP (tos 0x0, ttl 64, id 46325, offset 0, flags [DF], proto TCP (6), length 40)
    192.150.11.111.1080 > 98.114.205.102.2152: Flags [.], cksum 0x4e5d (correct), seq 1, ack 111617, win 63488, length 0
00:28:41.458053 IP (tos 0x0, ttl 113, id 16493, offset 0, flags [DF], proto TCP (6), length 1064)
    98.114.205.102.2152 > 192.150.11.111.1080: Flags [P.], cksum 0xc92e (correct), seq 111617:112641, ack 1, win 64240, length 1024
00:28:41.538133 IP (tos 0x0, ttl 64, id 46326, offset 0, flags [DF], proto TCP (6), length 40)
    192.150.11.111.1080 > 98.114.205.102.2152: Flags [.], cksum 0x4a5d (correct), seq 1, ack 112641, win 63488, length 0
00:28:41.602473 IP (tos 0x0, ttl 113, id 16503, offset 0, flags [DF], proto TCP (6), length 1500)
    98.114.205.102.2152 > 192.150.11.111.1080: Flags [.], cksum 0x1e5c (correct), seq 112641:114101, ack 1, win 64240, length 1460
00:28:41.604972 IP (tos 0x0, ttl 113, id 16504, offset 0, flags [DF], proto TCP (6), length 628)
    98.114.205.102.2152 > 192.150.11.111.1080: Flags [P.], cksum 0xc30f (correct), seq 114101:114689, ack 1, win 64240, length 588
00:28:41.604987 IP (tos 0x0, ttl 64, id 46327, offset 0, flags [DF], proto TCP (6), length 40)
    192.150.11.111.1080 > 98.114.205.102.2152: Flags [.], cksum 0x425d (correct), seq 1, ack 114689, win 63488, length 0
00:28:41.660691 IP (tos 0x0, ttl 113, id 16517, offset 0, flags [DF], proto TCP (6), length 1064)
    98.114.205.102.2152 > 192.150.11.111.1080: Flags [P.], cksum 0x231e (correct), seq 114689:115713, ack 1, win 64240, length 1024
00:28:41.660710 IP (tos 0x0, ttl 64, id 46328, offset 0, flags [DF], proto TCP (6), length 40)
    192.150.11.111.1080 > 98.114.205.102.2152: Flags [.], cksum 0x3e5d (correct), seq 1, ack 115713, win 63488, length 0
00:28:41.725654 IP (tos 0x0, ttl 113, id 16520, offset 0, flags [DF], proto TCP (6), length 1064)
    98.114.205.102.2152 > 192.150.11.111.1080: Flags [P.], cksum 0x5a0a (correct), seq 115713:116737, ack 1, win 64240, length 1024
00:28:41.780373 IP (tos 0x0, ttl 113, id 16522, offset 0, flags [DF], proto TCP (6), length 1064)
    98.114.205.102.2152 > 192.150.11.111.1080: Flags [P.], cksum 0x3f31 (correct), seq 116737:117761, ack 1, win 64240, length 1024
00:28:41.780389 IP (tos 0x0, ttl 64, id 46329, offset 0, flags [DF], proto TCP (6), length 40)
    192.150.11.111.1080 > 98.114.205.102.2152: Flags [.], cksum 0x365d (correct), seq 1, ack 117761, win 63488, length 0
00:28:41.903056 IP (tos 0x0, ttl 113, id 16532, offset 0, flags [DF], proto TCP (6), length 1064)
    98.114.205.102.2152 > 192.150.11.111.1080: Flags [P.], cksum 0x8085 (correct), seq 117761:118785, ack 1, win 64240, length 1024
00:28:42.007373 IP (tos 0x0, ttl 113, id 16544, offset 0, flags [DF], proto TCP (6), length 1500)
    98.114.205.102.2152 > 192.150.11.111.1080: Flags [.], cksum 0x1817 (correct), seq 118785:120245, ack 1, win 64240, length 1460
00:28:42.007390 IP (tos 0x0, ttl 64, id 46330, offset 0, flags [DF], proto TCP (6), length 40)
    192.150.11.111.1080 > 98.114.205.102.2152: Flags [.], cksum 0x2ca9 (correct), seq 1, ack 120245, win 63488, length 0
00:28:42.009871 IP (tos 0x0, ttl 113, id 16545, offset 0, flags [DF], proto TCP (6), length 628)
    98.114.205.102.2152 > 192.150.11.111.1080: Flags [P.], cksum 0x9c2b (correct), seq 120245:120833, ack 1, win 64240, length 588
00:28:42.009890 IP (tos 0x0, ttl 64, id 46331, offset 0, flags [DF], proto TCP (6), length 40)
    192.150.11.111.1080 > 98.114.205.102.2152: Flags [.], cksum 0x2a5d (correct), seq 1, ack 120833, win 63488, length 0
00:28:42.117311 IP (tos 0x0, ttl 113, id 16556, offset 0, flags [DF], proto TCP (6), length 1500)
    98.114.205.102.2152 > 192.150.11.111.1080: Flags [.], cksum 0xd640 (correct), seq 120833:122293, ack 1, win 64240, length 1460
00:28:42.119935 IP (tos 0x0, ttl 113, id 16557, offset 0, flags [DF], proto TCP (6), length 628)
    98.114.205.102.2152 > 192.150.11.111.1080: Flags [P.], cksum 0x1bbd (correct), seq 122293:122881, ack 1, win 64240, length 588
00:28:42.119950 IP (tos 0x0, ttl 64, id 46332, offset 0, flags [DF], proto TCP (6), length 40)
    192.150.11.111.1080 > 98.114.205.102.2152: Flags [.], cksum 0x225d (correct), seq 1, ack 122881, win 63488, length 0
00:28:42.209759 IP (tos 0x0, ttl 113, id 16563, offset 0, flags [DF], proto TCP (6), length 1500)
    98.114.205.102.2152 > 192.150.11.111.1080: Flags [.], cksum 0x64b7 (correct), seq 122881:124341, ack 1, win 64240, length 1460
00:28:42.212508 IP (tos 0x0, ttl 113, id 16564, offset 0, flags [DF], proto TCP (6), length 628)
    98.114.205.102.2152 > 192.150.11.111.1080: Flags [P.], cksum 0x46d7 (correct), seq 124341:124929, ack 1, win 64240, length 588
00:28:42.212523 IP (tos 0x0, ttl 64, id 46333, offset 0, flags [DF], proto TCP (6), length 40)
    192.150.11.111.1080 > 98.114.205.102.2152: Flags [.], cksum 0x1a5d (correct), seq 1, ack 124929, win 63488, length 0
00:28:42.335440 IP (tos 0x0, ttl 113, id 16589, offset 0, flags [DF], proto TCP (6), length 1064)
    98.114.205.102.2152 > 192.150.11.111.1080: Flags [P.], cksum 0xcebe (correct), seq 124929:125953, ack 1, win 64240, length 1024
00:28:42.335459 IP (tos 0x0, ttl 64, id 46334, offset 0, flags [DF], proto TCP (6), length 40)
    192.150.11.111.1080 > 98.114.205.102.2152: Flags [.], cksum 0x165d (correct), seq 1, ack 125953, win 63488, length 0
00:28:42.399904 IP (tos 0x0, ttl 113, id 16593, offset 0, flags [DF], proto TCP (6), length 1500)
    98.114.205.102.2152 > 192.150.11.111.1080: Flags [.], cksum 0x1ba9 (correct), seq 125953:127413, ack 1, win 64240, length 1460
00:28:42.402402 IP (tos 0x0, ttl 113, id 16594, offset 0, flags [DF], proto TCP (6), length 628)
    98.114.205.102.2152 > 192.150.11.111.1080: Flags [P.], cksum 0xeb22 (correct), seq 127413:128001, ack 1, win 64240, length 588
00:28:42.402418 IP (tos 0x0, ttl 64, id 46335, offset 0, flags [DF], proto TCP (6), length 40)
    192.150.11.111.1080 > 98.114.205.102.2152: Flags [.], cksum 0x0e5d (correct), seq 1, ack 128001, win 63488, length 0
00:28:42.525458 IP (tos 0x0, ttl 113, id 16604, offset 0, flags [DF], proto TCP (6), length 1064)
    98.114.205.102.2152 > 192.150.11.111.1080: Flags [P.], cksum 0x7ead (correct), seq 128001:129025, ack 1, win 64240, length 1024
00:28:42.525478 IP (tos 0x0, ttl 64, id 46336, offset 0, flags [DF], proto TCP (6), length 40)
    192.150.11.111.1080 > 98.114.205.102.2152: Flags [.], cksum 0x0a5d (correct), seq 1, ack 129025, win 63488, length 0
00:28:42.602416 IP (tos 0x0, ttl 113, id 16605, offset 0, flags [DF], proto TCP (6), length 1500)
    98.114.205.102.2152 > 192.150.11.111.1080: Flags [.], cksum 0x07a1 (correct), seq 129025:130485, ack 1, win 64240, length 1460
00:28:42.604915 IP (tos 0x0, ttl 113, id 16606, offset 0, flags [DF], proto TCP (6), length 628)
    98.114.205.102.2152 > 192.150.11.111.1080: Flags [P.], cksum 0xa706 (correct), seq 130485:131073, ack 1, win 64240, length 588
00:28:42.604931 IP (tos 0x0, ttl 64, id 46337, offset 0, flags [DF], proto TCP (6), length 40)
    192.150.11.111.1080 > 98.114.205.102.2152: Flags [.], cksum 0x025d (correct), seq 1, ack 131073, win 63488, length 0
00:28:42.647891 IP (tos 0x0, ttl 113, id 16610, offset 0, flags [DF], proto TCP (6), length 1064)
    98.114.205.102.2152 > 192.150.11.111.1080: Flags [P.], cksum 0x0c99 (correct), seq 131073:132097, ack 1, win 64240, length 1024
00:28:42.647910 IP (tos 0x0, ttl 64, id 46338, offset 0, flags [DF], proto TCP (6), length 40)
    192.150.11.111.1080 > 98.114.205.102.2152: Flags [.], cksum 0xfe5c (correct), seq 1, ack 132097, win 63488, length 0
00:28:42.770572 IP (tos 0x0, ttl 113, id 16623, offset 0, flags [DF], proto TCP (6), length 1064)
    98.114.205.102.2152 > 192.150.11.111.1080: Flags [P.], cksum 0xf661 (correct), seq 132097:133121, ack 1, win 64240, length 1024
00:28:42.810166 IP (tos 0x0, ttl 64, id 46339, offset 0, flags [DF], proto TCP (6), length 40)
    192.150.11.111.1080 > 98.114.205.102.2152: Flags [.], cksum 0xfa5c (correct), seq 1, ack 133121, win 63488, length 0
00:28:42.837285 IP (tos 0x0, ttl 113, id 16631, offset 0, flags [DF], proto TCP (6), length 1500)
    98.114.205.102.2152 > 192.150.11.111.1080: Flags [.], cksum 0x1810 (correct), seq 133121:134581, ack 1, win 64240, length 1460
00:28:42.840034 IP (tos 0x0, ttl 113, id 16632, offset 0, flags [DF], proto TCP (6), length 628)
    98.114.205.102.2152 > 192.150.11.111.1080: Flags [P.], cksum 0x266a (correct), seq 134581:135169, ack 1, win 64240, length 588
00:28:42.840050 IP (tos 0x0, ttl 64, id 46340, offset 0, flags [DF], proto TCP (6), length 40)
    192.150.11.111.1080 > 98.114.205.102.2152: Flags [.], cksum 0xf25c (correct), seq 1, ack 135169, win 63488, length 0
00:28:42.913118 IP (tos 0x0, ttl 113, id 16634, offset 0, flags [DF], proto TCP (6), length 1064)
    98.114.205.102.2152 > 192.150.11.111.1080: Flags [P.], cksum 0x003a (correct), seq 135169:136193, ack 1, win 64240, length 1024
00:28:42.913137 IP (tos 0x0, ttl 64, id 46341, offset 0, flags [DF], proto TCP (6), length 40)
    192.150.11.111.1080 > 98.114.205.102.2152: Flags [.], cksum 0xee5c (correct), seq 1, ack 136193, win 63488, length 0
00:28:42.962964 IP (tos 0x0, ttl 113, id 16648, offset 0, flags [DF], proto TCP (6), length 1064)
    98.114.205.102.2152 > 192.150.11.111.1080: Flags [P.], cksum 0x34fa (correct), seq 136193:137217, ack 1, win 64240, length 1024
00:28:43.035549 IP (tos 0x0, ttl 113, id 16654, offset 0, flags [DF], proto TCP (6), length 1064)
    98.114.205.102.2152 > 192.150.11.111.1080: Flags [P.], cksum 0x86de (correct), seq 137217:138241, ack 1, win 64240, length 1024
00:28:43.035565 IP (tos 0x0, ttl 64, id 46342, offset 0, flags [DF], proto TCP (6), length 40)
    192.150.11.111.1080 > 98.114.205.102.2152: Flags [.], cksum 0xe65c (correct), seq 1, ack 138241, win 63488, length 0
00:28:43.157981 IP (tos 0x0, ttl 113, id 16670, offset 0, flags [DF], proto TCP (6), length 1064)
    98.114.205.102.2152 > 192.150.11.111.1080: Flags [P.], cksum 0x6a22 (correct), seq 138241:139265, ack 1, win 64240, length 1024
00:28:43.274178 IP (tos 0x0, ttl 64, id 46343, offset 0, flags [DF], proto TCP (6), length 40)
    192.150.11.111.1080 > 98.114.205.102.2152: Flags [.], cksum 0xe25c (correct), seq 1, ack 139265, win 63488, length 0
00:28:43.329760 IP (tos 0x0, ttl 113, id 16679, offset 0, flags [DF], proto TCP (6), length 1500)
    98.114.205.102.2152 > 192.150.11.111.1080: Flags [.], cksum 0xa301 (correct), seq 139265:140725, ack 1, win 64240, length 1460
00:28:43.332509 IP (tos 0x0, ttl 113, id 16680, offset 0, flags [DF], proto TCP (6), length 628)
    98.114.205.102.2152 > 192.150.11.111.1080: Flags [P.], cksum 0x15c0 (correct), seq 140725:141313, ack 1, win 64240, length 588
00:28:43.332524 IP (tos 0x0, ttl 64, id 46344, offset 0, flags [DF], proto TCP (6), length 40)
    192.150.11.111.1080 > 98.114.205.102.2152: Flags [.], cksum 0xda5c (correct), seq 1, ack 141313, win 63488, length 0
00:28:43.396723 IP (tos 0x0, ttl 113, id 16690, offset 0, flags [DF], proto TCP (6), length 1064)
    98.114.205.102.2152 > 192.150.11.111.1080: Flags [P.], cksum 0x5983 (correct), seq 141313:142337, ack 1, win 64240, length 1024
00:28:43.396742 IP (tos 0x0, ttl 64, id 46345, offset 0, flags [DF], proto TCP (6), length 40)
    192.150.11.111.1080 > 98.114.205.102.2152: Flags [.], cksum 0xd65c (correct), seq 1, ack 142337, win 63488, length 0
00:28:43.452942 IP (tos 0x0, ttl 113, id 16692, offset 0, flags [DF], proto TCP (6), length 1064)
    98.114.205.102.2152 > 192.150.11.111.1080: Flags [P.], cksum 0xa2da (correct), seq 142337:143361, ack 1, win 64240, length 1024
00:28:43.518155 IP (tos 0x0, ttl 113, id 16698, offset 0, flags [DF], proto TCP (6), length 1064)
    98.114.205.102.2152 > 192.150.11.111.1080: Flags [P.], cksum 0xd078 (correct), seq 143361:144385, ack 1, win 64240, length 1024
00:28:43.518172 IP (tos 0x0, ttl 64, id 46346, offset 0, flags [DF], proto TCP (6), length 40)
    192.150.11.111.1080 > 98.114.205.102.2152: Flags [.], cksum 0xce5c (correct), seq 1, ack 144385, win 63488, length 0
00:28:43.569876 IP (tos 0x0, ttl 113, id 16702, offset 0, flags [DF], proto TCP (6), length 1500)
    98.114.205.102.2152 > 192.150.11.111.1080: Flags [.], cksum 0xf271 (correct), seq 144385:145845, ack 1, win 64240, length 1460
00:28:43.572500 IP (tos 0x0, ttl 113, id 16703, offset 0, flags [DF], proto TCP (6), length 628)
    98.114.205.102.2152 > 192.150.11.111.1080: Flags [P.], cksum 0xc9ad (correct), seq 145845:146433, ack 1, win 64240, length 588
00:28:43.572516 IP (tos 0x0, ttl 64, id 46347, offset 0, flags [DF], proto TCP (6), length 40)
    192.150.11.111.1080 > 98.114.205.102.2152: Flags [.], cksum 0xc65c (correct), seq 1, ack 146433, win 63488, length 0
00:28:43.690560 IP (tos 0x0, ttl 113, id 16712, offset 0, flags [DF], proto TCP (6), length 1064)
    98.114.205.102.2152 > 192.150.11.111.1080: Flags [P.], cksum 0x137f (correct), seq 146433:147457, ack 1, win 64240, length 1024
00:28:43.690579 IP (tos 0x0, ttl 64, id 46348, offset 0, flags [DF], proto TCP (6), length 40)
    192.150.11.111.1080 > 98.114.205.102.2152: Flags [.], cksum 0xc25c (correct), seq 1, ack 147457, win 63488, length 0
00:28:43.757272 IP (tos 0x0, ttl 113, id 16722, offset 0, flags [DF], proto TCP (6), length 1500)
    98.114.205.102.2152 > 192.150.11.111.1080: Flags [.], cksum 0xcbcd (correct), seq 147457:148917, ack 1, win 64240, length 1460
00:28:43.759771 IP (tos 0x0, ttl 113, id 16723, offset 0, flags [DF], proto TCP (6), length 628)
    98.114.205.102.2152 > 192.150.11.111.1080: Flags [P.], cksum 0x4d84 (correct), seq 148917:149505, ack 1, win 64240, length 588
00:28:43.759787 IP (tos 0x0, ttl 64, id 46349, offset 0, flags [DF], proto TCP (6), length 40)
    192.150.11.111.1080 > 98.114.205.102.2152: Flags [.], cksum 0xba5c (correct), seq 1, ack 149505, win 63488, length 0
00:28:43.867462 IP (tos 0x0, ttl 113, id 16735, offset 0, flags [DF], proto TCP (6), length 1500)
    98.114.205.102.2152 > 192.150.11.111.1080: Flags [.], cksum 0xc3cd (correct), seq 149505:150965, ack 1, win 64240, length 1460
00:28:43.869959 IP (tos 0x0, ttl 113, id 16736, offset 0, flags [DF], proto TCP (6), length 628)
    98.114.205.102.2152 > 192.150.11.111.1080: Flags [P.], cksum 0x4584 (correct), seq 150965:151553, ack 1, win 64240, length 588
00:28:43.869976 IP (tos 0x0, ttl 64, id 46350, offset 0, flags [DF], proto TCP (6), length 40)
    192.150.11.111.1080 > 98.114.205.102.2152: Flags [.], cksum 0xb25c (correct), seq 1, ack 151553, win 63488, length 0
00:28:43.990518 IP (tos 0x0, ttl 113, id 16748, offset 0, flags [DF], proto TCP (6), length 1064)
    98.114.205.102.2152 > 192.150.11.111.1080: Flags [P.], cksum 0xff7e (correct), seq 151553:152577, ack 1, win 64240, length 1024
00:28:43.990538 IP (tos 0x0, ttl 64, id 46351, offset 0, flags [DF], proto TCP (6), length 40)
    192.150.11.111.1080 > 98.114.205.102.2152: Flags [.], cksum 0xae5c (correct), seq 1, ack 152577, win 63488, length 0
00:28:44.069848 IP (tos 0x0, ttl 113, id 16751, offset 0, flags [DF], proto TCP (6), length 1500)
    98.114.205.102.2152 > 192.150.11.111.1080: Flags [.], cksum 0xb7cd (correct), seq 152577:154037, ack 1, win 64240, length 1460
00:28:44.072597 IP (tos 0x0, ttl 113, id 16752, offset 0, flags [DF], proto TCP (6), length 628)
    98.114.205.102.2152 > 192.150.11.111.1080: Flags [P.], cksum 0x3984 (correct), seq 154037:154625, ack 1, win 64240, length 588
00:28:44.072613 IP (tos 0x0, ttl 64, id 46352, offset 0, flags [DF], proto TCP (6), length 40)
    192.150.11.111.1080 > 98.114.205.102.2152: Flags [.], cksum 0xa65c (correct), seq 1, ack 154625, win 63488, length 0
00:28:44.193279 IP (tos 0x0, ttl 113, id 16753, offset 0, flags [DF], proto TCP (6), length 1064)
    98.114.205.102.2152 > 192.150.11.111.1080: Flags [P.], cksum 0xf37e (correct), seq 154625:155649, ack 1, win 64240, length 1024
00:28:44.193299 IP (tos 0x0, ttl 64, id 46353, offset 0, flags [DF], proto TCP (6), length 40)
    192.150.11.111.1080 > 98.114.205.102.2152: Flags [.], cksum 0xa25c (correct), seq 1, ack 155649, win 63488, length 0
00:28:44.289850 IP (tos 0x0, ttl 113, id 16758, offset 0, flags [DF], proto TCP (6), length 1500)
    98.114.205.102.2152 > 192.150.11.111.1080: Flags [.], cksum 0xabcd (correct), seq 155649:157109, ack 1, win 64240, length 1460
00:28:44.292473 IP (tos 0x0, ttl 113, id 16759, offset 0, flags [DF], proto TCP (6), length 628)
    98.114.205.102.2152 > 192.150.11.111.1080: Flags [P.], cksum 0x2d84 (correct), seq 157109:157697, ack 1, win 64240, length 588
00:28:44.292489 IP (tos 0x0, ttl 64, id 46354, offset 0, flags [DF], proto TCP (6), length 40)
    192.150.11.111.1080 > 98.114.205.102.2152: Flags [.], cksum 0x9a5c (correct), seq 1, ack 157697, win 63488, length 0
00:28:44.415405 IP (tos 0x0, ttl 113, id 16770, offset 0, flags [DF], proto TCP (6), length 1064)
    98.114.205.102.2152 > 192.150.11.111.1080: Flags [P.], cksum 0xe77e (correct), seq 157697:158721, ack 1, win 64240, length 1024
00:28:44.415425 IP (tos 0x0, ttl 64, id 46355, offset 0, flags [DF], proto TCP (6), length 40)
    192.150.11.111.1080 > 98.114.205.102.2152: Flags [.], cksum 0x965c (correct), seq 1, ack 158721, win 63488, length 0
00:28:44.471375 IP (tos 0x0, ttl 113, id 16785, offset 0, flags [DF], proto TCP (6), length 40)
    98.114.205.102.2152 > 192.150.11.111.1080: Flags [F.], cksum 0x936b (correct), seq 158721, ack 1, win 64240, length 0
00:28:44.471434 IP (tos 0x0, ttl 64, id 46356, offset 0, flags [DF], proto TCP (6), length 40)
    192.150.11.111.1080 > 98.114.205.102.2152: Flags [F.], cksum 0x965a (correct), seq 1, ack 158722, win 63488, length 0
00:28:44.471467 IP (tos 0x0, ttl 64, id 12624, offset 0, flags [DF], proto TCP (6), length 58)
    192.150.11.111.36296 > 98.114.205.102.8884: Flags [P.], cksum 0xb26f (correct), seq 72:78, ack 165, win 46, options [nop,nop,TS val 4055636635 ecr 438621], length 6
00:28:44.471999 IP (tos 0x0, ttl 113, id 16786, offset 0, flags [DF], proto TCP (6), length 75)
    98.114.205.102.8884 > 192.150.11.111.36296: Flags [P.], cksum 0x9cf5 (correct), seq 165:188, ack 72, win 64169, options [nop,nop,TS val 438721 ecr 4055634156], length 23
00:28:44.472012 IP (tos 0x0, ttl 64, id 12625, offset 0, flags [DF], proto TCP (6), length 52)
    192.150.11.111.36296 > 98.114.205.102.8884: Flags [.], cksum 0x59b0 (correct), seq 78, ack 188, win 46, options [nop,nop,TS val 4055636635 ecr 438721], length 0
00:28:44.472054 IP (tos 0x0, ttl 64, id 12626, offset 0, flags [DF], proto TCP (6), length 52)
    192.150.11.111.36296 > 98.114.205.102.8884: Flags [F.], cksum 0x59af (correct), seq 78, ack 188, win 46, options [nop,nop,TS val 4055636635 ecr 438721], length 0
00:28:44.588809 IP (tos 0x0, ttl 113, id 16792, offset 0, flags [DF], proto TCP (6), length 40)
    98.114.205.102.2152 > 192.150.11.111.1080: Flags [.], cksum 0x936a (correct), seq 158722, ack 2, win 64240, length 0
00:28:44.589184 IP (tos 0x0, ttl 113, id 16793, offset 0, flags [DF], proto TCP (6), length 52)
    98.114.205.102.8884 > 192.150.11.111.36296: Flags [.], cksum 0x5f38 (correct), seq 188, ack 79, win 64163, options [nop,nop,TS val 438722 ecr 4055636635], length 0
00:28:44.591557 IP (tos 0x0, ttl 113, id 16794, offset 0, flags [DF], proto TCP (6), length 79)
    98.114.205.102.8884 > 192.150.11.111.36296: Flags [P.], cksum 0xae21 (correct), seq 188:215, ack 79, win 64163, options [nop,nop,TS val 438722 ecr 4055636635], length 27
00:28:44.591570 IP (tos 0x0, ttl 64, id 0, offset 0, flags [DF], proto TCP (6), length 40)
    192.150.11.111.36296 > 98.114.205.102.8884: Flags [R], cksum 0x6879 (correct), seq 1545682667, win 0, length 0
00:28:44.593806 IP (tos 0x0, ttl 113, id 16795, offset 0, flags [DF], proto TCP (6), length 52)
    98.114.205.102.8884 > 192.150.11.111.36296: Flags [F.], cksum 0x5f1c (correct), seq 215, ack 79, win 64163, options [nop,nop,TS val 438722 ecr 4055636635], length 0
00:28:44.593813 IP (tos 0x0, ttl 64, id 0, offset 0, flags [DF], proto TCP (6), length 40)
    192.150.11.111.36296 > 98.114.205.102.8884: Flags [R], cksum 0x6879 (correct), seq 1545682667, win 0, length 0
